아티스트,타이틀,가사
어노인팅,온 땅의 주인 (Who Am I),온 땅의 주인 되신 주님이 내 이름 아시며 상한 맘 돌보네 어둠을 밝히시는 새벽 별 방황하는 내 맘 주의 길 비추시네 나로 인함이 아닌 주가 행하신 일로 나의 행함이 아닌 오직 주로 인하여 나는 오늘 피었다 지는 이름 없는 꽃과 같네 바다에 이는 파도 안개와 같지만 주는 나를 붙드시고 부르짖음 들으시며 날 귀하다 하시네 주님은 나의 죄를 보시고 사랑의 눈으로 날 일으키시네 바다를 잠잠하게 하시듯 내 영혼의 폭풍 고요케 하시네 나로 인함이 아닌 주가 행하신 일로 나의 행함이 아닌 오직 주로 인하여 나는 오늘 피었다 지는 이름 없는 꽃과 같네 바다에 이는 파도 안개와 같지만 주는 나를 붙드시고 부르짖음 들으시며 날 귀하다 하시네 나는 오늘 피었다 지는 이름 없는 꽃과 같네 바다에 이는 파도 안개와 같지만 주는 나를 붙드시고 부르짖음 들으시며 날 귀하다 하시네 나는 오늘 피었다 지는 이름 없는 꽃과 같네 바다에 이는 파도 안개와 같지만 주는 나를 붙드시고 부르짖음 들으시며 날 귀하다 하시네 나는 오늘 피었다 지는 이름 없는 꽃과 같네 바다에 이는 파도 안개와 같지만 주는 나를 붙드시고 부르짖음 들으시며 날 귀하다 하시네 나는 오늘 피었다 지는 이름 없는 꽃과 같네 바다에 이는 파도 안개와 같지만 주는 나를 붙드시고 부르짖음 들으시며 날 귀하다 하시네 나 오직 주의 것 나 오직 주의 것 나 오직 주의 것 나 오직 주의 것 나 오직 주의 것 나 오직 주의 것
어노인팅,주께서 내 맘에 두신 기쁨은,주께서 내 맘에 두신 기쁨은 이 세상 즐거움 비교할 수 없네 잠깐 있다 사라질 세상의 것과 다른 그 기쁨은 날마다 커져만 가네 주께서 내 맘에 두신 기쁨은 이 세상 즐거움 비교할 수 없네 잠깐 있다 사라질 세상의 것과 다른 그 기쁨은 날마다 커져만 가네 주가 주신 평안이 내 맘에 있어 주를 향한 찬양이 넘쳐흐르네 나를 안전하게 돌보시는 나의 주 하나님 주를 찬양하리라 주께서 내 인생 두신 소망은 이 세상 행복과 비교할 수 없네 어둠속에 사라질 세상의 것과 다른 그 소망은 날마다 커져만 가네 주가 주신 평안이 내 맘에 있어 주를 향한 찬양이 넘쳐흐르네 나를 안전하게 돌보시는 나의 주 하나님 주를 찬양하리라 주가 주신 평안이 내 맘에 있어 주를 향한 찬양이 넘쳐흐르네 나를 안전하게 돌보시는 나의 주 하나님 주를 찬양하리라 주가 주신 평안이 내 맘에 있어 주를 향한 찬양이 넘쳐흐르네 나를 안전하게 돌보시는 나의 주 하나님 주를 찬양하리라 주가 주신 평안이 내 맘에 있어 주를 향한 찬양이 넘쳐흐르네 나를 안전하게 돌보시는 나의 주 하나님 주를 찬양하리라 주가 주신 평안이 내 맘에 있어 주를 향한 찬양이 넘쳐흐르네 나를 안전하게 돌보시는 나의 주 하나님 주를 찬양하리라
어노인팅,모든 상황속에서,모든 상황 속에서 주를 찬양 할지라 주는 너의 큰 상급 큰 도움이시라 주의 얼굴 구할때 주의 영을 부으사 크신 사랑 안에서 주를 보게하소서 내 영혼이 확정되고 확정 되었사오니 믿음의 눈들어 주를 바라봅니다 내 영혼이 확정되고 확정 되었사오니 믿음의 눈들어 주를 바라봅니다 모든 상황 속에서 주를 찬양 할지라 주는 너의 큰 상급 큰 도움이시라 주의 얼굴 구할때 주의 영을 부으사 크신 사랑 안에서 주를 보게하소서 내 영혼이 확정되고 확정 되었사오니 믿음의 눈들어 주를 바라봅니다 내 영혼이 확정되고 확정되었사오니 믿음의 눈들어 주를 바라봅니다 내 영혼이 확정되고 확정 되었사오니 믿음의 눈들어 주를 바라봅니다 내 영혼이 확정되고 확정 되었사오니 믿음의 눈들어 주를 바라봅니다 주를 찬양 할때 주의 나라 이미 임했네 그의 영원한 나라 보게 하소서 내 영혼이 확정되고 확정 되었사오니 믿음의 눈들어 주를 바라봅니다 내 영혼이 확정되고 확정 되었사오니 믿음의 눈들어 주를 바라봅니다 내 영혼이 확정되고 확정 되었사오니 믿음의 눈들어 주를 바라봅니다 내 영혼이 확정되고 확정 되었사오니 믿음의 눈들어 주를 바라봅니다
어노인팅,푯대를 향하여,내게 유익하던 것을 다 해로 여기네 구주를 위하여 모두 다 버리네 모든 것을 잃어 버려도 나 아깝지 않음은 예수를 아는 지식이 가장 고상함이라 육체를 신뢰하지 않고 겸손한 마음으로 부활의 능력과 고난에 참여하며 그의 죽으심을 본 받아 그리스도를 얻고 예수의 안에서 발견되려 함이라 푯대를 향하여 그리스도 예수 안에서 부름의 상을 위하여 달려가노라 이전에 있는 것은 모두 잊어버리고 앞에 계신 그리스도께로 달려가노라 내게 유익하던 것을 다 해로 여기네 구주를 위하여 모두 다 버리네 모든 것을 잃어 버려도 나 아깝지 않음은 예수를 아는 지식이 가장 고상함이라 육체를 신뢰하지 않고 겸손한 마음으로 부활의 능력과 고난에 참여하며 그의 죽으심을 본 받아 그리스도를 얻고 예수의 안에서 발견되려 함이라 푯대를 향하여 그리스도 예수 안에서 부름의 상을 위하여 달려가노라 이전에 있는 것은 모두 잊어버리고 앞에 계신 그리스도께로 달려가노라 푯대를 향하여 그리스도 예수 안에서 부름의 상을 위하여 달려가노라 이전에 있는 것은 모두 잊어버리고 앞에 계신 그리스도께로 달려가노라 율법에서 난 것이 아니요 오직 그리스도를 믿는 믿음으로 난 것이라 푯대를 향하여 그리스도 예수 안에서 부름의 상을 위하여 달려가노라 이전에 있는 것은 모두 잊어버리고 앞에 계신 그리스도께로 달려가노라 푯대를 향하여 그리스도 예수 안에서 부름의 상을 위하여 달려가노라 이전에 있는 것은 모두 잊어버리고 앞에 계신 그리스도께로 달려가노라 이전에 있는 것은 모두 잊어버리고 앞에 계신 그리스도께로 달려가노라
어노인팅,성령이 오셨네,허무한 시절 지날 때  깊은 한 숨 내쉴 때  그런 풍경 보시며  탄식하는 분 있네  고아같이 너희를  버려두지 않으리  내가 너희와 영원히  함께 하리라  성령이 오셨네  성령이 오셨네  내 주의 보내신  성령이 오셨네  우리 인생 가운데  친히 찾아 오셔서  그나라 꿈꾸게 하시네 억눌린 자 갇힌 자  자유함이 없는 자  피난처가 되시는  성령님 계시네  주의 영이 계신 곳에  참 자유가 있다네  진리의 영이신  성령이 오셨네  성령이 오셨네  성령이 오셨네  내 주의 보내신  성령이 오셨네  우리 인생 가운데  친히 찾아 오셔서  그나라 꿈꾸게 하시네  성령이 오셨네  성령이 오셨네  내 주의 보내신  성령이 오셨네  우리 인생 가운데  친히 찾아 오셔서  그나라 꿈꾸게 하시네  성령이 오셨네  성령이 오셨네  내 주의 보내신  성령이 오셨네  우리 인생 가운데  친히 찾아 오셔서  그나라 꿈꾸게 하시네  성령이 오셨네 성령이 오셨네 내 주의 보내신 성령이 오셨네 우리 인생 가운데 친히 찾아 오셔서 그나라 꿈꾸게 하시네 성령이 오셨네 성령이 오셨네 내 주의 보내신 성령이 오셨네 우리 인생 가운데 친히 찾아 오셔서 그나라 꿈꾸게 하시네 성령이 오셨네 성령이 오셨네 내 주의 보내신 성령이 오셨네 우리 인생 가운데 친히 찾아 오셔서 그나라 꿈꾸게 하시네
어노인팅,나는 예배자입니다,나는 하나님을 예배하는 예배자입니다 내가 서있는 곳 어디서나 하나님을 예배합니다 내 영혼 거룩한 은혜를 향하여 내 마음 완전한 하나님 향하여 이 곳에서 바로 이 시간 하나님을 예배합니다 나는 하나님을 예배하는 예배자입니다 내가 서있는 곳 어디서나 하나님을 예배합니다 내 영혼 거룩한 은혜를 향하여 내 마음 완전한 하나님 향하여 이 곳에서 바로 이 시간 하나님을 예배합니다 나는 하나님을 예배하는 예배자입니다 내가 서있는 곳 어디서나 하나님을 예배합니다 내 영혼 거룩한 은혜를 향하여 내 마음 완전한 하나님 향하여 이 곳에서 바로 이 시간 하나님을 예배합니다 내 영혼 거룩한 은혜를 향하여 내 마음 완전한 하나님 향하여 이 곳에서 바로 이 시간 하나님을 예배합니다 내 영혼 거룩한 은혜를 향하여 내 마음 완전한 하나님 향하여 이 곳에서 바로 이 시간 하나님을 예배합니다 내 영혼 거룩한 은혜를 향하여 내 마음 완전한 하나님 향하여 이 곳에서 바로 이 시간 하나님을 예배합니다
어노인팅,어떤 말로도,어떤 말로도 모두 다 말할 수 없네 내게 차고 넘치게 채워 주시는 은혜 무슨 노래로 이것을 모두 말할까 멈추지 않으시는 나를 향하신 사랑 어떤 말로도 모두 다 말할 수 없네 내게 차고 넘치게 채워 주시는 은혜 무슨 노래로 이것을 모두 말할까 멈추지 않으시는 나를 향하신 사랑 멈출 수 없네 멈추지 않으리 주를 향해 부르는 이 노래 다함이 없네 끝나지 않으리 우릴 향해 넘치는 그 사랑 어떤 말로도 모두 다 말할 수 없네 내게 차고 넘치게 채워 주시는 은혜 무슨 노래로 이것을 모두 말할까 멈추지 않으시는 나를 향하신 사랑 멈출 수 없네 멈추지 않으리 주를 향해 부르는 이 노래 다함이 없네 끝나지 않으리 우릴 향해 넘치는 그 사랑 어떤 말로도 모두 다 말할 수 없네 내게 차고 넘치게 채워 주시는 은혜 무슨 노래로 이것을 모두 말할까 멈추지 않으시는 나를 향하신 사랑 어떤 말로도 모두 다 말할 수 없네 내게 차고 넘치게 채워 주시는 은혜 무슨 노래로 이것을 모두 말할까 멈추지 않으시는 나를 향하신 사랑 멈추지 않으시는 나를 향하신 사랑
어노인팅,주와 같이 길 가는 것,주와 같이 길가는 것 즐거운 일 아닌가 우리 주님 걸어가신 발자취를 밟겠네 주와 같이 길가는 것 즐거운 일 아닌가 우리 주님 걸어가신 발자취를 밟겠네 한 걸음 한 걸음 주 예수와 함께 날마다 날마다 우리는 걷겠네 어린아이 같은 우리 미련하고 약하나 주의 손에 이끌리어 생명길로 가겠네 어린아이 같은 우리 미련하고 약하나 주의 손에 이끌리어 생명길로 가겠네 한 걸음 한 걸음 주 예수와 함께 날마다 날마다 우리는 걷겠네 한 걸음 한 걸음 주 예수와 함께 날마다 날마다 우리는 걷겠네 주와 같이 길가는 것 즐거운 일 아닌가 우리 주님 걸어가신 발자취를 밟겠네 주와 같이 길가는 것 즐거운 일 아닌가 우리 주님 걸어가신 발자취를 밟겠네 한 걸음 한 걸음 주 예수와 함께 날마다 날마다 우리는 걷겠네 한 걸음 한 걸음 주 예수와 함께 날마다 날마다 우리는 걷겠네 한 걸음 한 걸음 주 예수와 함께 날마다 날마다 우리는 걷겠네
어노인팅,주 사랑이 나를 숨 쉬게 해,주 사랑이 나를 숨쉬게 해  세상 그 어떤 어려움 속에도 주 은혜로 나를 돌보시며 세상 끝날까지 지켜주시네 주님만이 내 아픔 아시며 주님만이 내 맘 어루만지네 어느 누구도 나를 향하신 주님의 사랑을 끊을 수 없네 주님만이 내 능력이시며 주님만이 나의 구원이시네 어느 누구도 나를 향하신 주님의 사랑을 끊을 수 없네 주 사랑이 나를 숨쉬게 해  세상 그 어떤 어려움 속에도 주 은혜로 나를 돌보시며 세상 끝날까지 지켜주시네 주 사랑이 나를 이끄시네 내가 갈 수 없는 그 곳으로 주의 사랑 나를 붙드시며 세상 끝날까지 인도하시네 주 사랑이 나를 숨쉬게 해  세상 그 어떤 어려움 속에도 주 은혜로 나를 돌보시며 세상 끝날까지 지켜주시네 주 사랑이 나를 이끄시네 내가 갈 수 없는 그 곳으로 주의 사랑 나를 붙드시며 세상 끝날까지 인도하시네 주님만이 내 아픔 아시며 주님만이 내 맘 어루만지네 어느 누구도 나를 향하신 주님의 사랑을 끊을 수 없네 주님만이 내 능력이시며 주님만이 나의 구원이시네 어느 누구도 나를 향하신 주님의 사랑을 끊을 수 없네 주님만이 내 아픔 아시며 주님만이 내 맘 어루만지네 어느 누구도 나를 향하신 주님의 사랑을 끊을 수 없네 주님만이 내 능력이시며 주님만이 나의 구원이시네 어느 누구도 나를 향하신 주님의 사랑을 끊을 수 없네 주님만이 내 아픔 아시며 주님만이 내 맘 어루만지네 어느 누구도 나를 향하신 주님의 사랑을 끊을 수 없네 주님만이 내 능력이시며 주님만이 나의 구원이시네 어느 누구도 나를 향하신 주님의 사랑을 끊을 수 없네 주님만이 내 아픔 아시며 주님만이 내 맘 어루만지네 어느 누구도 나를 향하신 주님의 사랑을 끊을 수 없네 주님만이 내 능력이시며 주님만이 나의 구원이시네 어느 누구도 나를 향하신 주님의 사랑을 끊을 수 없네 주님만이 내 아픔 아시며 주님만이 내 맘 어루만지네 어느 누구도 나를 향하신 주님의 사랑을 끊을 수 없네 주님만이 내 아픔 아시며 주님만이 내 맘 어루만지네 어느 누구도 나를 향하신 주님의 사랑을 끊을 수 없네 주님만이 내 능력이시며  주님만이 나의 구원이시네  어느 누구도 나를 향하신 주님의 사랑을 끊을 수 없네 어느 누구도 나를 향하신 주님의 사랑을 끊을 수 없네 어느 무엇도 나를 향하신 주님의 사랑을 끊을 수 없네
어노인팅,예수 우리들의 밝은 빛,예수 우리들의 밝은 빛 은혜와 긍휼을 베푸시는 주 의의 길을 따라가는 주의 자녀들에게 항상 밝은 빛을 비추시네 그는 구원의 주 하나님 공의로 세상을 다스리시네 주를 경외하는 자들에게 부어주시는 놀라운 주님의 영광 하늘에서 찬란하게 빛나는 주의 영광 이 땅에 오셨네 어둠을 밝히고 새 생명 주시네 영원히 빛나는 나의 예수님 높이 영광과 찬양 받으실 그 이름 경배합니다 슬픔을 거두고 내게 자유주시네 기쁨의 노래를 영원한 나의 빛 예수께 예수 우리들의 밝은 빛 은혜와 긍휼을 베푸시는 주 의의 길을 따라가는 주의 자녀들에게 항상 밝은 빛을 비추시네 그는 구원의 주 하나님 공의로 세상을 다스리시네 주를 경외하는 자들에게 부어주시는 놀라운 주님의 영광 하늘에서 찬란하게 빛나는 주의 영광 이 땅에 오셨네 어둠을 밝히고 새 생명 주시네 영원히 빛나는 나의 예수님 높이 영광과 찬양 받으실 그 이름 경배합니다 슬픔을 거두고 내게 자유주시네 기쁨의 노래를 영원한 나의 빛 예수께 하늘에서 찬란하게 빛나는 주의 영광 이 땅에 오셨네 어둠을 밝히고 새 생명 주시네 영원히 빛나는 나의 예수님 높이 영광과 찬양 받으실 그 이름 경배합니다 슬픔을 거두고 내게 자유주시네 기쁨의 노래를 영원한 나의 빛 예수께 하늘에서 찬란하게 빛나는 주의 영광 이 땅에 오셨네 어둠을 밝히고 새 생명 주시네 영원히 빛나는 나의 예수님 높이 영광과 찬양 받으실 그 이름 경배합니다 슬픔을 거두고 내게 자유주시네 기쁨의 노래를 영원한 나의 빛 예수께 하늘에서 찬란하게 빛나는 주의 영광 이 땅에 오셨네 어둠을 밝히고 새 생명 주시네 영원히 빛나는 나의 예수님 높이 영광과 찬양 받으실 그 이름 경배합니다 슬픔을 거두고 내게 자유주시네 기쁨의 노래를 영원한 나의 빛 예수께 하늘에서 찬란하게 빛나는 주의 영광 이 땅에 오셨네 어둠을 밝히고 새 생명 주시네 영원히 빛나는 나의 예수님 높이 영광과 찬양 받으실 그 이름 경배합니다 슬픔을 거두고 내게 자유주시네 기쁨의 노래를 영원한 나의 빛 예수께
어노인팅,소원,나의 평생에 단 한가지 소원 주의 아름다우심 보며 사랑 노래 하는 것 나의 왕 되신 주님의 얼굴 구하며 주 사랑 안에 머물러 사랑 노래합니다 나의 평생에 단 한가지 소원 주의 아름다우심 보며 사랑 노래 하는 것 나의 왕 되신 주님의 얼굴 구하며 주 사랑 안에 머물러 사랑 노래합니다 나의 평생에 단 한가지 소원 주의 아름다우심 보며 사랑 노래 하는 것 나의 왕 되신 주님의 얼굴 구하며 주 사랑 안에 머물러 사랑 노래합니다
어노인팅,온 맘 다해 (With All My Heart),주님과 함께 하는 이 고요한 시간 주님의 보좌 앞에 내 마음을 쏟네 모든 것 아시는 주님께 감출것 없네 내 맘과 정성다해 주 바라나이다 주님과 함께 하는 이 고요한 시간 주님의 보좌 앞에 내 마음을 쏟네 모든 것 아시는 주님께 감출것 없네 내 맘과 정성다해 주 바라나이다 온 맘 다해 사랑합니다 온 맘 다해 주 알기 원하네 내 모든 삶 당신 것이니 주만 섬기리 온 맘 다해 나 염려하잖아도 내 쓸 것 아시니 나 오직 주의 얼굴 구하게 하소서 다 이해할 수 없을 때라도 감사하며 날마다 순종하며 주 따르오리다 온 맘 다해 사랑합니다 온 맘 다해 주 알기 원하네 내 모든 삶 당신 것이니 주만 섬기리 온 맘 다해 온 맘 다해 사랑합니다 온 맘 다해 주 알기 원하네 내 모든 삶 당신 것이니 주만 섬기리 온 맘 다해 온 맘 다해 사랑합니다 온 맘 다해 주 알기 원하네 내 모든 삶 당신 것이니 주만 섬기리 온 맘 다해 온 맘 다해 사랑합니다 온 맘 다해 주 알기 원하네 내 모든 삶 당신 것이니 주만 섬기리 온 맘 다해 주만 섬기리 온 맘 다해
어노인팅,주님 한분 만으로,주님의 크신 사랑 찬양해 나의 힘과 능력이 되신주 나의 모든 삶 변화되었네 크신 주의 사랑 찬양해 주님 한분 만으로 나는 만족해 나의 모든것 되신 주님 찬양해 나의 영원한 생명 되신 예수님 목소리 높여 찬양해 주님의 크신 사랑 찬양해 나의 힘과 능력이 되신주 나의 모든 삶 변화되었네 크신 주의 사랑 찬양해 주님 한분 만으로 나는 만족해 나의 모든것 되신 주님 찬양해 나의 영원한 생명 되신 예수님 목소리 높여 찬양해 주님의 크신 사랑 찬양해 나의 힘과 능력이 되신주 나의 모든 삶 변화되었네 크신 주의 사랑 찬양해 주님의 크신 사랑 찬양해 나의 힘과 능력이 되신주 나의 모든 삶 변화되었네 크신 주의 사랑 찬양해 크신 주의 사랑 찬양해
어노인팅,내 진정 사모하는,내 진정 사모하는 친구가 되시는 구주 예수님은 아름다워라 산 밑에 백합화요 빛나는 새벽별 주님 형언할 길 아주 없도다 내 맘이 아플적에 큰 위로되시며 나 외로울 때 좋은 친구라 주는 저산 밑에 백합 빛나는 새벽별 이 땅위에 비길 것이 없도다 내 몸의 모든 염려 이세상 고락간 나와 항상 같이 하여주시고 시험을 당할 때에 악마의 계교를 즉시 물리치사 날 지키시네 온세상 날버려도 주예수 안 버려 끝까지 나를 돌아보시니 주는 저산밑에 백합 빛나는 새벽별 이 땅위에 비길것이 없도다 주는 나를 영원토록 기르시는 목자 나는 그를 따라가는 작은자 변찮고 나를 사랑하는 주님 계셔 두렵잖고 주를 따라가는 내가 있어 나의 산성 나의 방패 요새 힘이 되신 주를 영원토록 찬양해 초원으로 인도하는 주를 항상 의지해요 내 영혼 먹이시는 그 은혜 누리고 나 친히 주를 뵙기 원하네 주는 저산 밑에 백합 빛나는 새벽별 이 땅위에 비길것이 없도다 내 맘이 아플적에 큰위로되시며 나 외로울 때 좋은 친구라 주는 저산 밑에 백합 빛나는 새벽별 이 땅위에 비길 것이 없도다
어노인팅,약할 때 강함 되시네,예수 어린 양 존귀한 이름 예수 어린 양 존귀한 이름 예수 어린 양 존귀한 이름 예수 어린 양 존귀한 이름 약할 때 강함 되시네 나의 보배가 되신 주 주 나의 모든 것 주 안에 있는 보물을 나는 포기 할 수 없네 주 나의 모든 것 십자가 죄 사하셨네 주님의 이름 찬양해 주 나의 모든 것 쓰러진 나를 세우고 나의 빈 잔을 채우네 주 나의 모든 것 예수 어린 양 존귀한 이름 예수 어린 양 존귀한 이름 예수 어린 양 존귀한 이름 예수 어린 양 존귀한 이름 예수 어린 양 존귀한 이름 예수 어린 양 존귀한 이름 존귀한 이름 구원의 이름 소망의 이름 능력의 이름
어노인팅,내 영혼은 안전합니다,내 아버지 그 품 안에서 내 영혼은 안전합니다 주 손길로 내 삶을 안으시니 그 평강이 나를 덮습니다 내 아버지 그 품 안에서 내 영혼은 안전합니다 주 손길로 내 삶을 안으시니 그 평강이 나를 덮습니다 나 비록 넘어지며 흔들리지만 주 내 안에 거하며 나를 붙드시니 내 생각을 주께로 돌리고 주시는 평강의 옷을 입습니다 주 약속 안에서 내 영혼 평안해 내 뜻보다 크신 주님의 계획 나 신뢰해 두려움 다 내려놓고 주님만 의지해 주 안에서 내 영혼 안전합니다 내 아버지 그 품 안에서 내 영혼은 안전합니다 주 손길로 내 삶을 안으시니 그 평강이 나를 덮습니다 나 비록 넘어지며 흔들리지만 주 내 안에 거하며 나를 붙드시니 내 생각을 주께로 돌리고 주시는 평강의 옷을 입습니다 주 약속 안에서 내 영혼 평안해 내 뜻보다 크신 주님의 계획 나 신뢰해 두려움 다 내려놓고 주님만 의지해 주 안에서 내 영혼 안전합니다 주 약속 안에서 내 영혼 평안해 내 뜻보다 크신 주님의 계획 나 신뢰해 두려움 다 내려놓고 주님만 의지해 주 안에서 내 영혼 안전합니다 주 약속 안에서 내 영혼 평안해 내 뜻보다 크신 주님의 계획 나 신뢰해 두려움 다 내려놓고 주님만 의지해 주 안에서 내 영혼 안전합니다 두려움 다 내려놓고 주님만 의지해 주 안에서 내 영혼 안전합니다
어노인팅,오늘 이 곳에 계신 성령님,오늘 이 곳에 계신 성령님 우리에게 말씀하시고 우릴 가르치소서 닫힌 우리 맘 열어주시고 주의 빛으로 밝혀 우릴 인도하소서 오늘 이 곳에 계신 성령님 우리에게 말씀하시고 우릴 가르치소서 닫힌 우리 맘 열어주시고 주의 빛으로 밝혀 우릴 인도하소서 주님보다 앞서지 않고 겸손하게 주님의 말씀 기다리니 주님 손에 우릴 드립니다 사랑으로 인도하소서 오늘 이 곳에 계신 성령님 우리에게 말씀하시고 우릴 가르치소서 닫힌 우리 맘 열어주시고 주의 빛으로 밝혀 우릴 인도하소서 주님보다 앞서지 않고 겸손하게 주님의 말씀 기다리니 주님 손에 우릴 드립니다 사랑으로 인도하소서 주님보다 앞서지 않고 겸손하게 주님의 말씀 기다리니 주님 손에 우릴 드립니다 사랑으로 인도하소서 창조하신 모습 떠난 우리를 예수님 닮게 빚으소서 주님보다 앞서지 않고 겸손하게 주님의 말씀 기다리니 주님 손에 우릴 드립니다 사랑으로 인도하소서 주님보다 앞서지 않고 겸손하게 주님의 말씀 기다리니 주님 손에 우릴 드립니다 사랑으로 인도하소서 사랑으로 인도하소서 사랑으로 말씀하소서
