아티스트,타이틀,가사
어노인팅,곧 오시네,공중에 나팔이 울려나고 온 땅이 흔들릴 때 사람의 손으로 세워진 것 모두 다 무너지리 세상의 헛된 영광 썩어질 헛된 우상 사망 권세 모두 깨뜨리신 주님 발 앞에 무너지리 모든 영광과 존귀와 능력 죽임 당하신 어린 양께 모든 눈이 왕의 위엄 보게 되리 모든 영광과 존귀와 능력 부활하신 주 예수님께 영광 중에 구름 타고 주 오시네 주님 곧 오시네 주 다시 오실 날 멀잖았네 주 맞을 준비하라 사랑으로 무장한 주의 신부 교회여 일어나라 우리의 삶을 드려 주의 길 예비할 때 주의 권세 주의 크신 능력 모든 나라가 보게 되리 모든 영광과 존귀와 능력 죽임 당하신 어린 양께 모든 눈이 왕의 위엄 보게 되리 모든 영광과 존귀와 능력 부활하신 주 예수님께 영광 중에 구름 타고 주오시네 모든 영광과 존귀와 능력 죽임 당하신 어린 양께 모든 눈이 왕의 위엄 보게 되리 모든 영광과 존귀와 능력 부활하신 주 예수님께 영광 중에 구름 타고 주오시네 주님 곧 오시네 곧 오시네 곧 오시네 왕의 왕 곧 오시네 곧 오시네 곧 오시네 왕의 왕 곧 오시네 곧 오시네 곧 오시네 왕의 왕 곧 오시네 곧 오시네 곧 오시네 왕의 왕 곧 오시네 곧 오시네 곧 오시네 왕의 왕 곧 오시네 곧 오시네 곧 오시네 왕의 왕 곧 오시네 모든 영광과 존귀와 능력 죽임 당하신 어린 양께 모든 눈이 왕의 위엄 보게 되리 모든 영광과 존귀와 능력 부활하신 주 예수님께 영광 중에 구름 타고 주오시네 모든 영광과 존귀와 능력 죽임 당하신 어린 양께 모든 눈이 왕의 위엄 보게 되리 모든 영광과 존귀와 능력 부활하신 주 예수님께 영광 중에 구름 타고 주오시네 주님 곧 오시네
어노인팅,주예수의 이름 높이세,주 예수의 이름 높이세 온 땅을 덮는 깃발처럼 모든 사람들 진리를 보며 길 되신 주를 알리 주 예수의 이름 높이세 온 땅을 덮는 깃발처럼 모든 사람들 진리를 보며 길 되신 주를 알리 주 예수여 주 예수여 높임을 받으시옵소서 주 예수여 주 예수여 높임을 받으시옵소서 주 예수의 이름 높이세 온땅을 덮는 깃발처럼 모든 사람들 진리를 보며 길 되신 주를 알리 주 예수여 주 예수여 높임을 받으시옵소서 주 예수여 주 예수여 높임을 받으시옵소서 한 걸음씩 전진하며 이 땅을 정복해가네 기도로 무기 삼으면 원수는 무너지리 무너지리라 주 예수의 이름 높이세 온땅을 덮는 깃발처럼 모든 사람들 진리를 보며 길 되신 주를 알리 주 예수여 주 예수여 높임을 받으시옵소서 주 예수여 주 예수여 높임을 받으시옵소서 주 예수여 주 예수여 높임을 받으시옵소서 주 예수여 주 예수여 높임을 받으시옵소서 주 예수여 주 예수여 높임을 받으시옵소서 주 예수여 주 예수여 높임을 받으시옵소서 주 예수여 주 예수여 높임을 받으시옵소서 주 예수여 주 예수여 높임을 받으시옵소서 주 예수여 주 예수여 높임을 받으시옵소서 주 예수여 주 예수여 높임을 받으시옵소서
어노인팅,십자가에서,십자가에서 그는 내 이름 바꾸셨네 십자가에서 그는 내 이름 바꾸셨네 십자가에서 그는 내 이름 바꾸셨네 십자가에서 그는 내 이름 바꾸셨네 고아에서 아들로 거절에서 용납으로 죄인에서 의인으로 바꾸어 주셨네 고아에서 아들로 거절에서 용납으로 죄인에서 의인으로 바꾸어 주셨네 십자가에서 그는 내 이름 바꾸셨네 십자가에서 그는 내 이름 바꾸셨네 십자가에서 그는 내 이름 바꾸셨네 십자가에서 그는 내 이름 바꾸셨네 저주에서 축복으로 원수에서 연인으로 창기에서 신부로 바꾸어 주셨네 저주에서 축복으로 원수에서 연인으로 창기에서 신부로 바꾸어 주셨네
어노인팅,"우물가의 여인처럼 Fill My Cup, Lord (DVD-Mix)",우물가의 여인처럼 난 구했네 헛되고 헛된 것들을 그때 주님하신 말씀 내 샘에와 생수를 마셔라 오 주님 채우소서 나의 잔을 높이 듭니다 하늘 양식 내게 채워 주소서 넘치도록 채워주소서 오 주님 채우소서 나의 잔을 높이 듭니다 하늘 양식 내게 채워 주소서 넘치도록 채워주소서 많고 많은 사람들이 찾았었네 헛되고 헛된 것들을 주 안에 감추인 보배 세상 것과 난 비길 수 없네 많고 많은 사람들이 찾았었네 헛되고 헛된 것들을 주 안에 감추인 보배 세상 것과 난 비길 수 없네 오 주님 채우소서 나의 잔을 높이 듭니다 하늘 양식 내게 채워 주소서 넘치도록 채워주소서 오 주님 채우소서 나의 잔을 높이 듭니다 하늘 양식 내게 채워 주소서 넘치도록 채워주소서 오 주님 채우소서 나의 잔을 높이 듭니다 하늘 양식 내게 채워 주소서 넘치도록 채워주소서 하늘 양식 내게 채워 주소서 넘치도록 채워주소서 하늘 양식 내게 채워 주소서 넘치도록 채워주소서
어노인팅,은밀한 곳 조용한 곳에 (강동균),은밀한 곳 조용한 곳에  주님 그 곳에 계시네  은밀하게 조용하게  주님만을 기다리리  주를 더 알기 원하네 은밀한 곳 조용한 곳에  주님 그 곳에 계시네  은밀하게 조용하게  주님만을 기다리리  주를 더 알기 원하네 주 알기 원해 그 음성 듣기를  간절히 원하네  주 보기 원해 주님을 만나길  간절히 원하네 은밀한 곳 조용한 곳에  주님 그 곳에 계시네  은밀하게 조용하게  주님만을 기다리리  주를 더 알기 원하네 주 알기 원해 그 음성 듣기를  간절히 원하네  주 보기 원해 주님을 만나길  간절히 원하네 주 알기 원해 그 음성 듣기를  간절히 원하네  주 보기 원해 주님을 만나길  간절히 원하네 주 알기 원해 그 음성 듣기를  간절히 원하네  주 보기 원해 주님을 만나길  간절히 원하네 주 알기 원해 그 음성 듣기를  간절히 원하네  주 보기 원해 주님을 만나길  간절히 원하네 주 알기 원해 그 음성 듣기를 간절히 원하네 주 보기 원해 주님을 만나길 간절히 원하네
어노인팅,호산나,찬양 중에 눈을 들어 주를 주를 보네 소망 중에 마음 다해 주만 나 바라네 주님을 볼 때 나에게 힘 주시네 주님 안에 모든 두렴 사라져 사라져 호산나 호산나 구원의 주 하나님 찬양 받으실 주님 호산나 호산나 내 안에 임하셔서 주님의 뜻 이루소서 주께 드린 마음 다한 기도 들으소서 주의 나라 상한 영혼들을 새롭게 해 주님을 볼 때 나에게 힘 주시네 주님 안에 모든 두렴 사라져 사라져 호산나 호산나 구원의 주 하나님 찬양 받으실 주님 호산나 호산나 내 안에 임하셔서 주님의 뜻 이루소서 호산나 호산나 구원의 주 하나님 찬양 받으실 주님 호산나 호산나 내 안에 임하셔서 주님의 뜻 이루소서
어노인팅,만세 반석 (인도 : 조준모),주님같은 반석은 없도다  찬양받기 합당하신 이름  변치않으시는 구원의 반석  신실하시고 진실하신 주  주님같은 반석은 없도다  주님같은 반석은 없도다  찬양받기 합당하신 이름  변치않으시는 구원의 반석  신실하시고 진실하신 주  주님같은 반석은 없도다  만세반석  예수 내 반석  만세반석  예수 내 반석  만세반석  예수 내 반석  주님같은 반석은 없도다  주님같은 반석은 없도다  찬양받기 합당하신 이름  변치않으시는 구원의 반석  신실하시고 진실하신 주  주님같은 반석은 없도다  주님같은 반석은 없도다  찬양받기 합당하신 이름  변치않으시는 구원의 반석  신실하시고 진실하신 주  주님같은 반석은 없도다  만세반석  예수 내 반석  만세반석  예수 내 반석  만세반석  예수 내 반석  주님같은 반석은 없도다  만세반석  예수 내 반석  만세반석  예수 내 반석  만세반석  예수 내 반석  만세반석  예수 내 반석  만세반석  예수 내 반석  주님같은 반석은 없도다  주님같은 반석은 없도다  주님같은 반석은 없도다
어노인팅,정결 (강명식),거룩하신 성령님 지금 내게 오셔서  나의 눈 열어 보게 하소서  나의 마음 깊은 곳 주님 슬퍼하시는  죄와 부정함 보게 하소서  거룩하신 성령님 지금 내게 오셔서  나의 눈 열어 보게 하소서  나의 마음 깊은 곳 주님 슬퍼하시는  죄와 부정함 보게 하소서  주 성령의 불로 소멸하는 거룩한 불로  죄의 소원 태워주시고 정결하게 하소서 주 얼굴 보고 거룩하신 주님 닿도록 정직하며 새롭게 하사 정결하게 하소서 거룩하신 성령님 지금 내게 오셔서  나의 눈 열어 보게 하소서  나의 마음 깊은 곳 주님 슬퍼하시는  죄와 부정함 보게 하소서  보게 하소서 보게 하소서 주 성령의 불로 소멸하는 거룩한 불로  죄의 소원 태워주시고 정결하게 하소서 주 얼굴 보고 거룩하신 주님 닮도록 정직하며 새롭게 하사 정결하게 하소서 주 성령의 불로 소멸하는 거룩한 불로 죄의 소원 태워주시고 정결하게 하소서 주 얼굴 보고 거룩하신 주님 닮도록 정직하며 새롭게 하사 정결하게 하소서 주 성령의 불로 소멸하는 거룩한 불로 주 성령의 불로 소멸하는 거룩한 불로 주 성령의 불로 소멸하는 거룩한 불로 주 성령의 불로 소멸하는 거룩한 불로 주 성령의 불로 소멸하는 거룩한 불로 주 성령의 불로 소멸하는 거룩한 불로 주 성령의 불로 소멸하는 거룩한 불로 죄의 소원 태워주시고 정결하게 하소서 주 얼굴 보고 거룩하신 주님 닮도록 정직하며 새롭게 하사 정결하게 하소서
어노인팅,예수 감사하리 주의 보혈,예수 감사하리 주의 보혈  축복 속에 우린 자유를  노래해  예수 감사하리 주의 승리  승리 안에 우린 구원을  노래해  구원을 노래해  새롭고 산 길이 되신 예수  길과 진리 생명 되셨네  우릴 주의 자녀 삼으셨네  자유를 노래할 때  예수 감사하리 주의 보혈  축복 속에 우린 자유를  노래해  예수 감사하리 주의 승리  승리 안에 우린 구원을  노래해  구원을 노래해  새롭고 산 길이 되신 예수  길과 진리 생명 되셨네  우릴 주의 자녀 삼으셨네  자유를 노래할 때  주 행한 일 찬양 주  행한 일 찬양  승리하시고 구속하신  주님 찬양해  주 행한 일 찬양 주  행한 일 찬양  승리하시고 구속하신  주님 찬양해  새롭고 산 길이 되신 예수  길과 진리 생명 되셨네  우릴 주의 자녀 삼으셨네  자유를 노래할 때  주 행한 일 찬양 주  행한 일 찬양  승리하시고 구속하신  주님 찬양해  주 행한 일 찬양 주  행한 일 찬양  승리하시고 구속하신  주님 찬양해  주 행한 일 찬양 주  행한 일 찬양  승리하시고 구속하신  주님 찬양해  주 행한 일 찬양 주  행한 일 찬양  승리하시고 구속하신  주님 찬양해
어노인팅,사랑해요 목소리 높여,사랑해요 목소리 높여 경배해요 내 영혼 기뻐 오 나의 왕 나의 목소리 주님 귀에 곱게 곱게 울리리 사랑해요 예수님 높여 경배해요 내 영혼 기뻐 오 나의 왕 나의 목소리 주님 귀에 곱게 곱게 울리리 오 나의 왕 나의 목소리 주님 귀에 곱게 곱게 주님 귀에 곱게 곱게 주님 귀에 곱게 곱게 주님 귀에 곱게 곱게 주님 귀에 곱게 곱게 울리리
어노인팅,찬양의 이유되신 주님,찬양의 이유 되신 주님 경배의 이유 되신 나의 왕 모든 것 주신 주님 모든 것 주신 주님 완전한 삶 살기 위하여 생명 말씀 빛 되기 위하여 죽음으로 화목케 하시고 부활 능력 보이려 오신 주 찬양의 이유 되신 주님 나의 모든 것을 다 드리네 경배의 이유 되신 나의 왕 모든 것 주신 주님 모든 것 주신 주님 우리 안에 거하시려고 승리의 왕 친구 되시려고 사랑으로 우리를 고치시려 영원한 곳 예비해 주신 주 찬양의 이유 되신 주님 나의 모든 것을 다 드리네 경배의 이유 되신 나의 왕 모든 것 주신 주님 찬양의 이유 되신 주님 나의 모든 것을 다 드리네 경배의 이유 되신 나의 왕 모든 것 주신 주님 모든 것 주신 주님 할렐 할렐루야 할렐 할렐루야 할렐 할렐루야 할렐 할렐루야 할렐 할렐루야 할렐 할렐루야 할렐 할렐루야 할렐 할렐루야 찬양의 이유 되신 주님 나의 모든 것을 다 드리네 경배의 이유 되신 나의 왕 모든 것 주신 주님 찬양의 이유 되신 주님 나의 모든 것을 다 드리네 경배의 이유 되신 나의 왕 모든 것 주신 주님 모든 것 주신 주님
어노인팅,예수여 예수여,참된 평화의 왕 참된 사랑의 주 하나님의 아들 예수 벽을 허무시고 하나 되게 하신 나를 위해 오신 예수 그 몸을 낮춰 발을 씻기시고 그 몸을 던져 길을 만드시네 두 팔을 벌려 나를 안으시고 생명의 길로 나를 오라 시네 예수여 예수여 이제 내가 일어나 내 모습 이대로 주께 돌아갑니다 참된 평화의 왕 참된 사랑의 주 하나님의 아들 예수 벽을 허무시고 하나 되게 하신 나를 위해 오신 예수 그 몸을 낮춰 발을 씻기시고 그 몸을 던져 길을 만드시네 두 팔을 벌려 나를 안으시고 생명의 길로 나를 오라 시네 예수여 예수여 이제 내가 일어나 내 모습 이대로 주께 돌아갑니다 예수여 예수여 이제 내가 일어나 내 모습 이대로 주께 돌아갑니다 풍성한 주의 긍휼 내 영 자유케 하사 멀어진 주와 나를 하나 되게 하셨네 풍성한 주의 긍휼 내 영 자유케 하사 멀어진 주와 나를 하나 되게 하셨네 예수여 예수여 이제 내가 일어나 내 모습 이대로 주께 돌아갑니다 예수여 예수여 주의 품에 안기어 영원한 사랑에 주를 따라갑니다 예수여 예수여 주의 품에 안기어 영원한 사랑에 주를 따라갑니다 예수여 예수여 주의 품에 안기어 영원한 사랑에 주를 따라갑니다
어노인팅,주님만이,주님만이 나의 구원 주님만이 나의 반석 나는 영원히 주 찬양하리 주님만이 나의 승리 주님만이 나의 능력 나는 더욱 더 주 의지하리 주님만이 나의 구원 주님만이 나의 반석 나는 영원히 주 찬양하리 주님만이 나의 승리 주님만이 나의 능력 나는 더욱 더 주 의지하리 아무것도 보이지 않는 광야의 길 걸어갈때도 보이지 않는 주님의 손이 나를 붙잡고 인도하시니 나 두렴없이 달려가리라 주님만이 나의 구원 주님만이 나의 반석 나는 영원히 주 찬양하리 주님만이 나의 승리 주님만이 나의 능력 나는 더욱 더 주 의지하리 내 모습에 절망할 때도 원수가 날 조롱할 때도 나를 향하신 주님의 사랑 끝까지 나를 사랑하시니 나 기쁨으로 선포하리라 내 모습에 절망할 때도 원수가 날 조롱할 때도 나를 향하신 주님의 사랑 끝까지 나를 사랑하시니 나 기쁨으로 선포하리라 사망이나 생명이나 이 세상의 그 무엇도 주 사랑에서 끊을 수 없네 사망이나 생명이나 이 세상의 그 무엇도 주 사랑에서 끊을 수 없네 주님만이 나의 구원 주님만이 나의 반석 나는 영원히 주 찬양하리 주님만이 나의 승리 주님만이 나의 능력 나는 더욱 더 주 의지하리 주님만이 주님만이 주님만이 주님만이
어노인팅,흐르네 주 보혈,흐르네 주 보혈 내 맘 깊은 곳 흐르네 주 보혈 내 맘 깊은 곳 주 보혈이 내 영혼 살리시네 흐르네 주 보혈 내 맘 깊은 곳 흐르네 주 보혈 내 맘 깊은 곳 흐르네 주 보혈 내 맘 깊은 곳 주 보혈이 내 영혼 살리시네 흐르네 주 보혈 내 맘 깊은 곳 흐르네 주 사랑 내 맘 깊은 곳 흐르네 주 사랑 내 맘 깊은 곳 주 사랑이 내 영혼 살리시네 흐르네 주 사랑 내 맘 깊은 곳 흐르네 주 보혈 내 맘 깊은 곳 흐르네 주 보혈 내 맘 깊은 곳 주 보혈이 내 영혼 살리시네 흐르네 주 보혈 내 맘 깊은 곳 흐르네 주 사랑 내 맘 깊은 곳 흐르네 주 사랑 내 맘 깊은 곳 주 사랑이 내 영혼 살리시네 흐르네 주 사랑 내 맘 깊은 곳 주 보혈이 내 영혼 살리시네 흐르네 주 보혈 내 맘 깊은 곳
어노인팅,온땅과 만민들아,온 땅과 만민들아 주를 찬양하라 온 땅과 만민들아 주를 찬양하라 온 땅과 만민들아 주를 찬양하라 온 땅과 만민들아 주를 찬양하라 그 놀라운 일들을 찬양하라 그 능하신 행동을 찬양하라 그는 영광의 주 그는 만왕의 왕 온 땅과 만민들아 주를 찬양하라 온 땅과 만민들아 주를 찬양하라 온 땅과 만민들아 주를 찬양하라 온 땅과 만민들아 주를 찬양하라 그 놀라운 일들을 찬양하라 그 능하신 행동을 찬양하라 그는 영광의 주 그는 만왕의 왕 그 놀라운 일들을 찬양하라 그 능하신 행동을 찬양하라 그는 영광의 주 그는 만왕의 왕 온 땅과 만민들아 주를 찬양하라 온 땅과 만민들아 주를 찬양하라 온 땅과 만민들아 주를 찬양하라 온 땅과 만민들아 주를 찬양하라 온 땅과 만민들아 주를 찬양하라 온 땅과 만민들아 주를 찬양하라 온 땅과 만민들아 주를 찬양하라 온 땅과 만민들아 주를 찬양하라
어노인팅,경건,천국의 소망 품은 당신은 주님 앞에 설 바로 당신은 그의 편지로 이 땅에 보내신 주의 손과 발 작은 예수 천국의 소망 품은 당신은 주님 앞에 설 바로 당신은 그의 편지로 이 땅에 보내신 주의 손과 발 작은 예수 주님 앞에서 흠없는 경건은 고아와 과부를 위해 삶 나누는 것 주 이름으로 사랑을 전할 때 아름다운 주의 나라 이뤄지네 천국의 소망 품은 당신은 주님 앞에 설 바로 당신은 그의 편지로 이 땅에 보내신 주의 손과 발 작은 예수 우리의 손은 예수님의 손 우리의 얼굴 바로 주님 얼굴 우리의 소유 모두 주님의 것 이웃을 위해 맡기셨네 우리의 손은 예수님의 손 우리의 얼굴 바로 주님 얼굴 우리의 소유 모두 주님의 것 이웃을 위해 맡기셨네 주님 앞에서 흠없는 경건은 고아와 과부를 위해 삶 나누는 것 주 이름으로 사랑을 전할 때 아름다운 주의 나라 이뤄지네 주님 앞에서 흠없는 경건은 어려운 이웃을 위해 삶 나누는 것 주 이름으로 사랑을 전할 때 아름다운 주의 나라 이뤄지네 주님 앞에서 흠없는 경건은 고아와 과부를 위해 삶 나누는 것 주 이름으로 사랑을 전할 때 아름다운 주의 나라 이뤄지네 천국의 소망 품은 당신은 주님 앞에 설 바로 당신은 그의 편지로 이 땅에 보내신 주의 손과 발 작은 예수 주의 손과 발 작은 예수 주의 손과 발 작은 예수
어노인팅,주님의 세계로,주님의 세계로 나아가세요 우리 주님 안에는 두려움이 없습니다 주님의 세계로 나아가세요 우리 주님 안에는 두려움이 없습니다 주님의 세계로 나아가세요 우리 주님 안에는 두려움이 없습니다 주님의 세계로 나아가세요 우리 주님 안에는 두려움이 없습니다 두려움이 없습니다 두려움이 없습니다
어노인팅,어두움 후에 빛이 오며,어두움 후에 빛이 오며 바람 분 후에 잔잔하고 소나기 후에 햇빛 나며 수고한 후에 쉼이 있네 연약함 후에 강건하며 애통한 후에 위로 받고 눈물 난 후에 웃음 있고 씨 뿌린 후에 추수하네 괴로움 후에 평안 있고 슬퍼한 후에 기쁨 있고 멀어진 후에 가까우며 고독함 후에 친구 있네 고생한 후에 기쁨 있고 십자가 후에 영광 있고 죽음 온 후에 영생하니 이러한 도가 진리로다 고생한 후에 기쁨 있고 십자가 후에 영광 있고 죽음 온 후에 영생하니 이러한 도가 진리로다 이러한 도가 진리로다
어노인팅,내 평생에 가는 길 (Reprise) (인도 : 박철순),내 영혼 평안해 내 영혼 내 영혼 평안해 내 영혼 평안해 내 영혼 내 영혼 평안해
어노인팅,이 세상의 부요함보다 (인도 : 오재성),이 세상의 부요함보다 이 세상의 좋은 친구보다 나의 꿈을 이루는 것보다 더 귀한분 필요한 모든 것을 다 얻고  내가 원한 삶을 사는 것 보다  어느 누구의 그 사랑 보다  귀한 분  붙드소서  주님 나를 놓지마소서  내 영혼 비추시고  내게 생명 주신 주님  주의 사랑 너무 커  나의 맘 드려 주께  주님만 영원히 사랑해  나의 사랑 멈추지 않으리  이 세상의 부요함보다  이 세상의 좋은 친구보다  나의 꿈을 이루는 것보다  더 귀한분  필요한 모든 것을 다 얻고  내가 원한 삶을 사는 것 보다  어느 누구의 그 사랑 보다  귀한 분 붙드소서  주님 나를 놓지마소서 내 영혼 비추시고  내게 생명 주신 주님  주의 사랑 너무 커  나의 맘 드려 주께  주님만 영원히 사랑해  나의 사랑 멈추지 않으리  주님만 영원히 사랑해  나의 사랑 멈추지 않으리  붙드소서  주님 나를 놓지 마소서 붙드소서  주님 나를 놓지 마소서 내 영혼 비추시고  내게 생명 주신 주님  주의 사랑 너무 커  나의 맘 드려 주께  주님만 영원히 사랑해  나의 사랑 멈추지 않으리 주님만 영원히 사랑해  나의 사랑 멈추지 않으리 내 영혼 비추시고 내게 생명 주신 주님 주의 사랑 너무 커 나의 맘 드려 주께 주님만 영원히 사랑해 나의 사랑 멈추지 않으리 주님만 영원히 사랑해 나의 사랑 멈추지 않으리
어노인팅,하나님 우리를 부르시네,하나님 우리를 부르시네 영원한 집으로 친밀한 주 음성 오라시네 아버지 품으로 하나님 우리를 부르시네 영원한 집으로 친밀한 주 음성 오라시네 아버지 품으로 지친 내 영혼 맞아주시고 허기진 마음 채우시네 모든 것 아시는 나의 주님 나 여기 영원히 거하리 아버지 품 안에 나 안기어 끝없는 사랑 누리리 하나님 우리를 부르시네 영원한 집으로 친밀한 주 음성 오라시네 아버지 품으로 지친 내 영혼 맞아주시고 허기진 마음 채우시네 모든 것 아시는 나의 주님 나 여기 영원히 거하리 아버지 품 안에 나 안기어 끝없는 사랑 누리리 모든 것 아시는 나의 주님 나 여기 영원히 거하리 아버지 품 안에 나 안기어 끝없는 사랑 누리리 아버지 품 안에 나 안기어 끝없는 사랑 누리리
어노인팅,알레 알렐루야 Alle (CD Mix),알레 알렐루 알레 알렐루 알레 알렐루야 알레 알렐루 알레 알렐루 알레 알렐루야 알레 알렐루 알레 알렐루 알레 알렐루야 알레 알렐루 알레 알렐루 알레 알렐루야 알레 알렐루 알레 알렐루 알레 알렐루야 알레 알렐루 알레 알렐루 알레 알렐루야 알레 알렐루 알레 알렐루 알레 알렐루야 알레 알렐루 알레 알렐루 알레 알렐루야 구원과 존귀와 영광을 주님께 보좌 위 어린양 예수 구원과 존귀와 영광을 주님께 오직 한 분 주님께 알레 알렐루 알레 알렐루 알레 알렐루야 알레 알렐루 알레 알렐루 알레 알렐루야 온 세계의 구석구석으로부터 주께 합당한 영광을 온 세계의 구석구석으로부터 소리높여 찬양해 알레 알렐루 알레 알렐루 알레 알렐루야 알레 알렐루 알레 알렐루 알레 알렐루야 모든족속 모든방언 모든민족 모든나라 Sing 알렐루 Sing 알렐루야 모든족속 모든방언 모든민족 모든나라 Sing 알렐루 Sing 알렐루야 모든족속 모든방언 모든민족 모든나라 Sing 알렐루 Sing 알렐루야 모든족속 모든방언 모든민족 모든나라 Sing 알렐루 Sing 알렐루야 모든족속 모든방언 모든민족 모든나라 Sing 알렐루 Sing 알렐루야 모든족속 모든방언 모든민족 모든나라 Sing 알렐루 Sing 알렐루야 모든족속 모든방언 모든민족 모든나라 Sing 알렐루 Sing 알렐루야 모든족속 모든방언 모든민족 모든나라 Sing 알렐루 Sing 알렐루야 알레 알렐루 알레 알렐루 알레 알렐루야 알레 알렐루 알레 알렐루 알레 알렐루야 알레 알렐루 알레 알렐루 알레 알렐루야 알레 알렐루 알레 알렐루
