아티스트,타이틀,가사
예수전도단,여호와여,여호와여 나의 대적이요 어찌 그리 많은지요 일어나 나를 치는 자가 많소이다 많은 사람들이 나를 가리켜 말하기를 저는 하나님께 도움얻지 못한다 하나이다  여호와여 나의 대적이요 어찌 그리 많은지요 일어나 나를 치는 자가 많소이다 많은 사람들이 나를 가리켜 말하기를 저는 하나님께 도움얻지 못한다 하나이다  아리 아라리요 아리 아라리요 아리 아라리요 아리 아라리요  여호와여 주는 나의 방패시요 나의 영광이시요 나의 머리를 드시는 자니이다 내가 나의 목소리로 여호와께 부르짖으니 그 성산에서 응답하시는도다  아리 아라리요 아리 아라리요 아리 아라리요 아리 아라리요 (헤이~)  내가 누워자고 깨었으니 여호와께서 나를 붙드심이로다 (천만인이 나를 둘러치려 하여도) 나는 두려워 아니 하리이다 여호와여 일어나소서  나의 하나님이여 나를 구원하소서 주께서 나의 모든원수의 뺨을 치시며 악인의 이 를 꺾으셨나이다  구원은 여호와께 있사오니 주의 복을 주의 백성에게 내리소서
예수전도단,아버지의 사랑,아버지의 사랑은 영원하여라 삶의 물결에 부딪히고 낙망하여 침울할때 깨달으면 얼마나 놀라운 일이냐  아버지의 사랑은 항상 날 에워싸고 방황하는 마음엔 힘을 외로운 가슴엔 위로를 항상 풍성히 내려주시네  아버지는 언제나 내곁에 계시니 고민을 말씀드리면 이해못하심 없으라  아버지의 사랑은 영원하여라 삶의 물결에 부딪치고 낙망하여 침울할때 깨달으면 얼마나 놀라운 일이냐  아버지는 언제나 내 곁에 계시니 고민을 말씀드리면 이해못하심 없으라  아버지의 사랑은 영원하고 자비는 한없어 관대하심을 깨달아 그 약속 믿기만 하면 된다오 (그 약속 믿기만하면된다오) 아버지의 사랑은 영원하고 자비는 한없어 관대하심을 깨달아 그 약속 믿기만 하면 된다오 (그 약속 믿기만하면된다오)  아- (그 약속 믿기만)
예수전도단,너영나영,1. 아침에 우는 새는 배가 고파 울고요 저녁에 우는 새는 님 기려서 운다 (후렴) 너영 나영 두리둥실 어영 낮에 낮에나 밤에 밤에나 참사랑이로구나 2. 너영 나영 서로 사랑하면은 새인들 너희 보고 제자인줄 안다 후렴 3. 우리가 살면은 몇만년 사나 아무리 잘 살아도 단 팔십일세 후렴 4. 예수를 잘 믿으면 세상이 변하구요 예수를 잘 못 믿으면 엉터리 세상 된다 후렴 5. 예수를 믿으면은 천국 가게 되구요 예수를 안 믿으면 지옥에서 슬피 운다 후렴
예수전도단,거룩한 성전,1.거룩한 성전에 거하시며 하늘보좌에 계신주 &lt;BR&gt; 주가 베푸신 모든사랑 우리 찬양을 주님께 &lt;BR&gt; 찬양 할렐루야 할렐루야 할렐루야 할렐루야 &lt;BR&gt; 할렐루야 할렐루야 할렐루야 &lt;BR&gt; &lt;BR&gt;2.오 거룩한 주의영광 승리의 함성 들리네 &lt;BR&gt; 죽임당하신 어린양께 우리 큰소리 외치며 &lt;BR&gt; 찬양 할렐루야 할렐루야 할렐루야 할렐루야 &lt;BR&gt; 할렐루야 할렐루야 할렐루야 &lt;BR&gt;
예수전도단,감람산,감람산 깊은 밤 중에  별빛은 희미하여라 주 예수 고민하시며  외로이 기도하시네 주 홀로 깊은 밤 중에  고민에 싸여 계시나 그 사랑 받던 제자도  스승의 괴롬 모르네 한밤 중 피땀 흘리며  인간의 죄를 지신 주 무릎을 꿇고 애쓸 때  성부는 힘을 주시네 한밤 중 하늘로부터  천사의 노래 들리니 인간은 듣지 못하나  예수는 위로받도다  인간은 듣지 못하나 예수는 위로받도다
예수전도단,영광 영광,영광 영광 왕께 영광을 영광 영광 왕께 영광을 영광의 왕이 뉘시뇨 그이름 예수라 온땅위에 가장 높으신 그이름 선포하리
예수전도단,주 사모합니다,주 사모합니다 내 영혼의 구주여 주의 눈길 내게 임하니 내 영혼이 기뻐 경배합니다 주의 손길 내게 임하니 내 영혼이 기뻐 경배합니다
예수전도단,물이 바다 덮음 같이,주 예수 오셔서 내 슬픔 아셨네 나의 앞 일도 내 주 아셨네 나 주를 버리고 떠나갔었네 주님 약속대로 날 붙드셨네 주 말씀하네 내 주님의 사랑 다 알 수 없지만 난 주를 믿네 날 위한 사랑 영광 다 버리고 나를 위하여 주 십자가 지사 자유 주셨네 주 말씀하네 내 마음과 영혼 다 주께 드리네 주 없는 삶은 다 허무한 것 영광 다 버리고 나를 위하여 주의 크신 사랑 나 찬양하리 (후렴) 넌 물가로 곧 나오라 내게 오라 네 목마른 것을 내가 채우리라 어둠에 헤맬 때 흘리던 네 눈물 그 눈물을 위해 내가 죽었노라
예수전도단,거룩 거룩 거룩,주는 거룩 거룩 오직 주님 만이 주는 거룩 거룩 영광 받으소서  주는 거룩 거룩 오직 주님 만이 주는 거룩 거룩 영광 받으소서  영원히 찬양합니다 더욱 사랑해요 주 보좌 앞 영원히 거하리 주께 더 가까이  주는 거룩 거룩 오직 주님 만이 주는 거룩 거룩 영광 받으소서  영원히 찬양합니다 더욱 사랑해요 주 보좌 앞 영원히 거하리 주께 더 가까이 (반복) 주는 거룩 거룩 주는 거룩 거룩
예수전도단,예수는 왕,예수는 왕 예수는 주 예수는 날 구원하신 주 예수는 왕 예수는 주 예수는 날 구원하신 주 왕께 만세 주께 만세 날 구원하신 주님께 만세 왕께 만세 주께 만세 날 구원하신 주님께 만세 강하고 능하신 왕 세상 모든 나라 다스리시네 소리높여 찬양해 그는 만유의 주 그는 만왕의 왕
예수전도단,할렐루야 찬양 예수,할렐루야 찬양 예수  할렐루야 주를 기뻐해  할렐루야 찬양 예수  할렐루야 주를 기뻐해   주는 광대하신 주 전능하신 왕  영원히 통치하리라
예수전도단,광대하신 주님,광대하신 주님 전능하신 주님 찬란하게 찬란하게 빛난 영광으로 옷 입으신 주님 광대하신 주님 전능하신 주님 찬란하게  찬란하게 빛난 영광으로 옷 입으신 주님 주의 이름 높이며 주 은혜 찬양 우릴 구원하신 주 통치하시네 광대하신 주님 전능하신 주님 찬란하게 찬란하게 빛난 영광으로 옷 입으신 주님 광대하신 주님 전능하신 주님 찬란하게 빛난 영광으로 옷 입으신 주님 주의 이름 높이며 주 은혜 찬양 우릴 구원하신 주 통치하시네 광대하신 주님 전능하신 주님 찬란하게 찬란하게 빛난 영광으로 옷 입으신 주님 광대하신 주님 전능하신 주님 찬란하게 찬란하게 빛난 영광으로 옷 입으신 주 옷 입으신 주 옷 입으신 주님
예수전도단,주님의 성령이 나에게,주님의 성령이 나에게 임하셨네 내게 기름을 부으사 가난한 자에게 주의 복음을 전하게 하려 하심이라 라라라라-라라라라
예수전도단,구원의 강,흐르네 주 보혈 구원의 강 죽었던 영혼들 살리시며 하늘 성소 휘장은 열리고 구원받은 영혼들 노래하네 흐르네 주 보혈 생명의 강 온 세상 나라들 치유하며 하늘 보좌 영광의 주님께 나라들은 일어나 경배하네
예수전도단,열방의 노래,경배해 경배해 하늘 보좌 주 앞에서 경배해 경배해 경배해 주의 얼굴 영광의 빛 비치네 은혜로우신 우리 하나님 그 자비하심은 영원 영원해  아버지의 크신 그 긍휼로 온 세상 그 품에 안으시네  온 세상 그 품에 안으시네 경배해 경배해 하늘 보좌 주 앞에서 경배해 경배해 경배해 주의 얼굴 영광의 빛 비치네  은혜로우신 우리 하나님 그 자비하심은 영원 영원해  아버지의 크신 그 긍휼로 온 세상 그 품에 안으시네  온 세상 그 품에 안으시네 열방은 그 품에 돌아오게 되리  그들을 위한 아버지의 눈물 알게 될 때  하늘과 땅 하나 되어 부르는 노래 시작되네 모든 나라 모든 족속 주 앞에 나와 경배하리 경배해 경배해 하늘 보좌 주 앞에서 경배해 경배해 경배해 주의 얼굴 영광의 빛 비치네 경배해 경배해 경배해 경배해 경배해 경배해 경배해 경배해 경배해 경배해
예수전도단,예수 사랑 나의 사랑,예수 사랑 나의 사랑 내 맘속에 넘쳐 형제를 사랑해 예수 사랑 나의 사랑 내 맘속에 넘쳐 형제를 사랑해 예수 사랑 나의 사랑 내 맘속에 넘쳐 형제를 사랑해 woo~~  예수 사랑 나의 사랑 내 맘속에 넘쳐 자매를 사랑해 예수 사랑 나의 사랑 내 맘속에 넘쳐 자매를 사랑해 woo~~  예수 사랑 나의 사랑 내 맘속에 넘쳐 주님을 사랑해 내 맘속에 넘쳐 주님을 사랑해 woo~~
예수전도단,축복하소서,축복하소서 우리에게 날마다 새롭게 세여나도록 축복하소서 우리에게 날마다 새롭게 세여나도록 주는 아버지 우리는 주의자녀 주님의 팔로 안아주소서 축복하소서 우리에게 날마다 새롭게 세여나도록
예수전도단,여호와,여호와 여호와 자비하신 은혜의 주 노하길 더디 하시는 인자와 긍휼의 하나님 사랑을 영원히 베푸시며 우리 죄 용서하시는 주 여호와 여호와 자비하신 은혜의 주 노하길 더디 하시는 인자와 긍휼의 하나님 사랑을 영원히 베푸시며 우리 죄 용서하시는 주 할렐루 할렐루야 할렐루야 할렐루 할렐루야 할렐루야 할렐루 할렐루야 할렐루야 할렐루 할렐루야 할렐루야 할렐루 할렐루야 할렐루야 할렐루 할렐루야 할렐루야
브라운 워십,나의 약함은 나의 자랑이요,참 고마운 친구 나의 예수님 나는 깨지기 쉬운 질그릇과 같으나 때론 낙심해도 포기치 않음은 예수의 생명이 내 안에 있기에 내 삶의 동행자 나의 예수님 나는 기대가 없는 어린 나귀 같으나 늘 쓰러지나 다시 일어남도 예수의 생명이 내 안에 있기에 나의 약함은 나의 자랑이요 나의 실패는 나의 간증이요 나의 아픔은 나의 영광이니 그 부르심 따라 내가 걸어갑니다 내 삶의 동행자 나의 예수님 나는 기대가 없는 어린 나귀 같으나 늘 쓰러지나 다시 일어남도 예수의 생명이 내 안에 있기에 나의 약함은 나의 자랑이요 나의 실패는 나의 간증이요 나의 아픔은 나의 영광이니 그 부르심 따라 내가 걸어갑니다 나의 약함은 나의 자랑이요 나의 실패는 나의 간증이요 나의 아픔은 나의 영광이니 그 부르심 따라 내가 걸어갑니다 나 가난함은 나의 상급이요 나 미련함은 나의 자랑이요 나 쓰러짐이 나의 고백이니 그 부르심 따라 내가 걸어갑니다 그 부르심 따라 그 부르심 따라 그 부르심 따라 그 부르심 따라 그 부르심 따라 그 부르심 따라 그 부르심 따라 그 부르심 따라 그 부르심 따라 그 부르심 따라 그 부르심 따라 그 부르심 따라
브라운 워십,주의 자비가 내려와,워 워 우워 워 워 워 주의 자비가 워 워 워 주의 자비가 주의 자비가 내려와 내려와 주의 자비가 봄비같이 주의 자비가 내려와 나를 덮네 주의 자비가 내려와 내려와 주의 자비가 봄비같이 주의 자비가 내려와 나를 덮네 자비가 나를 덮네 hey ho 주의 자비하심과 hey ho 주의 은혜로 hey ho 나는 영원히 춤추리 자비가 나를 덮네 hey ho 주의 자비하심과 hey ho 주의 은혜로 hey ho 나는 영원히 춤추리 주의 자비로 워 워 워 Mercy is falling 주의 자비가 워 워 워 Falling over me 워 워 워 주의 자비가 주의 자비가 내려와 내려와 주의 자비가 봄비같이 주의 자비가 내려와 나를 덮네 자비가 나를 덮네 주의 자비가 내려와 내려와 주의 자비가 봄비같이 주의 자비가 내려와 나를 덮네 자비가 나를 덮네 hey ho 주의 자비하심과 hey ho 주의 은혜로 hey ho 나는 영원히 춤추리 자비가 나를 덮네 hey ho 주의 자비하심과 hey ho 주의 은혜로 hey ho 나는 영원히 춤추리 주의 자비로 hey ho 주의 자비하심과 hey ho 주의 은혜로 hey ho 나는 영원히 춤추리 Dance forever more hey ho 주의 자비하심과 hey ho 주의 은혜로 hey ho 나는 영원히 춤추리 자비하신 자비하신 예수여 나를 보호하시고 항상 밝게 사랑하게 하소서 워 워 워 주의 자비가 워 워 워 mercy is falling 워 워 워 주의 자비가 주의 자비가 내려
브라운 워십,선한 목자 되신 우리 주,선한 목자 되신 우리 주 항상 인도하시고 푸른 풀밭 좋은 곳에서 우릴 먹여주소서 양의 문이 되신 예수여 우리 영접하시고 길을 잃은 양의 무리를 항상 인도하소서 선한 목자 구세주여 기도 들어주소서 선한 목자 구세주여 기도 들어주소서 인도하소서 인도하소서 일찍 주의 뜻을 따라서 살아가게 하시고 주의 크신 사랑 베푸사 따라가게 하소서 선한 목자 구세주여 지금 나아갑니다 선한 목자 구세주여 지금 나아갑니다 선한 목자 구세주여 항상 인도하소서 선한 목자 구세주여 항상 인도하소서 선한 목자 인도하소서 선한 목자 인도하소서 선한 목자 인도하소서 선한 목자 인도하소서
브라운 워십,노래할 수 없는 곳이라 해도,주님 사랑의 손길이 나를 만들어 내 모습 이대로 사용하여 주시네 흐트러진 마음을 만지시어 이끄시는 곳 어디라도 나는 주님 사랑의 손길이 나를 만들어 내 모습 이대로 사용하여 주시네 흐트러진 마음을 만지시어 이끄시는 곳 어디라도 나는 이끄시는 곳 어디라도 나는 노래하리 노래할 수 없는 곳이라 해도 난 노래하리 기도할 수 없는 곳이라 해도 난 기도하리 주님 사랑의 손길이 나를 만들어 내 모습 이대로 사용하여 주시네 흐트러진 마음을 만지시어 이끄시는 곳 어디라도 나는 노래하리 노래할 수 없는 곳이라 해도 난 노래하리 기도할 수 없는 곳이라 해도 난 기도하리 주님 사랑의 손길이 나를 만들어 내 모습 이대로 사용하여 주시네 흐트러진 마음을 만지시어 이끄시는 곳 어디라도 나는 주님 사랑의 손길이 나를 만들어 내 모습 이대로 사용하여 주시네 흐트러진 마음을 만지시어 이끄시는 곳 어디라도 나는 이끄시는 곳 어디라도 나는 이끄시는 곳 어디라도 나는 노래하리 노래하리 노래하리 노래하리 노래하리 노래하리 노래하리 노래하리
브라운 워십,주의 음성을 내가 들으니,주의 음성을 내가 들으니 사랑하는 말일세 믿는 맘으로 주께 가오니 나를 영접하소서 주여 넓으신 은혜 베푸사 나를 받아주시고 나의 품은 뜻 주의 뜻같이 되게 하여 주소서 내가 매일 십자가 앞에 더 가까이 가오니 구세주의 흘린 보배피로써 나를 정케 하소서 주의 보좌로 나아갈 때에 어찌 아니 기쁠까 주의 얼굴을 항상 뵈오니 더욱 친근합니다 우리 구주의 넓은 사랑을 측량할 자 없으며 주가 주시는 참된 기쁨도 헤아릴 수 없도다 내가 매일 십자가 앞에 더 가까이 가오니 구세주의 흘린 보배피로써 나를 정케 하소서 내가 매일 십자가 앞에 더 가까이 가오니 구세주의 흘린 보배피로써 나를 정케 하소서 내가 매일 십자가 앞에 더 가까이 가오니 구세주의 흘린 보배피로써 나를 정케 하소서 내가 매일 십자가 앞에 더 가까이 가오니 구세주의 흘린 보배피로써 나를 정케 하소서
브라운 워십,내 구주 예수를 더욱 사랑,내 구주 예수를 더욱 사랑 엎드려 비는 말 들으소서 내 진정 소원이 내 구주 예수를 더욱 사랑 더욱 사랑 내 구주 예수를 더욱 사랑 엎드려 비는 말 들으소서 내 진정 소원이 내 구주 예수를 더욱 사랑 더욱 사랑 이 세상 떠날 때 찬양하고 숨질 때 하는 말 이것일세 내 진정 소원이 내 구주 예수를 더욱 사랑 더욱 사랑 다만 내 비는 말 내 구주 예수를 더욱 사랑 더욱 사랑 내 진정 소원이 내 구주 예수를 더욱 사랑 더욱 사랑 더욱 사랑 더욱 사랑 더욱 사랑 더욱 사랑 더욱 사랑 더욱 사랑 더욱 사랑 더욱 사랑
브라운 워십,복음들고,복음 들고 산을 넘는 자들의 발길 아름답고도 아름답도다 평화전하며 복 된 소식을 외치네 주 다스리시네 주 다스리시네 주 다스리시네 주 다스리시네 주 다스리시네 복음 들고 산을 넘는 자들의 발길 아름답고도 아름답도다 평화전하며 복 된 소식을 외치네 주 다스리시네 주 다스리시네 주 다스리시네 주 다스리시네 주 다스리시네 주 다스리시네 주 다스리시네 주 다스리시네 주 다스리시네
브라운 워십,내 영혼의 그윽히 깊은 데서,내 영혼의 그윽히 깊은 데서 맑은 가락이 울려나네 하늘곡조가 언제나 흘러나와 내 영혼을 고이 싸네 평화 평화로다 하늘 위에서 내려오네 그 사랑의 물결이 영원토록 내 영혼을 덮으소서 평화 평화로다 하늘 위에서 내려오네 그 사랑의 물결이 영원토록 내 영혼을 덮으소서
브라운 워십,일어나라 찬양을 드리라,예-예-우- 일어나라 찬양을 드리라 우릴 구원하신 주께 영광 일어나라 찬양을 드리라 우릴 구원하신 주께 일어나라 찬양을 드리라 우릴 구원하신 주께 영광 일어나라 찬양을 드리라 우릴 구원하신 주께 마음 열고 주님 앞에 기뻐해 마음 열고 주님 앞에 기뻐해 마음 열고 주 앞에 기뻐해 주님은 우리 왕 일어나라 찬양을 드리라 우릴 구원하신 주께 영광 일어나라 찬양을 드리라 우릴 구원하신 주께 일어나라 찬양을 드리라 우릴 구원하신 주께 영광 일어나라 찬양을 드리라 우릴 구원하신 주께 마음 열어 주 앞에 마음 열어 주님께 모두 다 주 앞에 기뻐해 주님은 우리 왕 마음 열고 주님 앞에 기뻐해 마음 열고 주님 앞에 기뻐해 마음 열고 주 앞에 기뻐해 주님은 우리 왕 음- 내 삶의 찬양을 주님께 우- 마음 열어- 마음 열고 주님 앞에 기뻐해 마음 열고 주님 앞에 기뻐해 마음 열고 주님 앞에 기뻐해 주님은 우리 왕 마음 열어 주님께 마음 열어 주 앞에 모두 다 함께 기뻐해 주님은 우리 왕 마음 열고 주님 앞에 기뻐해 마음 열어 주를 기뻐해 마음 열고 주님 앞에 기뻐해 주님은 우리 왕
브라운 워십,나의 등 뒤에서 + 곤한 내 영혼 편히 쉴곳과,나의 등 뒤에서 나를 도우시는 주 나의 인생길에서 지치고 곤하여 매일처럼 주저앉고 싶을 때 나를 밀어주시네 일어나 걸어라 내가 새 힘을 주리니 일어나 너 걸어라 내 너를 도우리 나의 등 뒤에서 나를 도우시는 주 때때로 뒤돌아보면 여전히 계신 주 잔잔한 미소로 바라보시며 나를 재촉 하시네 일어나 걸어라 내가 새 힘을 주리니 일어나 너 걸어라 내 너를 도우리 일어나 걸어라 내가 새 힘을 주리니 일어나 너 걸어라 내 너를 도우리 일어나 너 걸어라 내가 새 힘을 주리니 일어나 너 걸어라 내 너를 도우리 일어나 너 걸어라 내가 새 힘을 주리니 일어나 너 걸어라 내 너를 도우리 주의 영원하신 팔 함께 하사 항상 나를 붙드시니  어느 곳에 가든지 요동하지 않음은 주의 팔을 의지함이라 주의 영원하신 팔 함께 하사 항상 나를 붙드시니  어느 곳에 가든지 요동하지 않음은 주의 팔을 의지함이라 주의 영원하신 팔 함께 하사 항상 나를 붙드시니  어느 곳에 가든지 요동하지 않음은 주의 팔을 의지함이라 주의 영원하신 팔 함께 하사 항상 나를 붙드시니  어느 곳에 가든지 요동하지 않음은 주의 팔을 의지함이라 주의 영원하신 팔 함께 하사 항상 나를 붙드시니  어느 곳에 가든지 요동하지 않음은 주의 팔을 의지함이라 주의 영원하신 팔 함께 하사 항상 나를 붙드시니 어느 곳에 가든지 요동하지 않음은 주의 팔을 의지함이라
브라운 워십,날마다 숨쉬는 순간마다,날마다 숨쉬는 순간마다 내 앞에 어려운 일 보네 주님 앞에 이 몸을 맡길 때 슬픔 없네 두려움 없네 날마다 주님 내 곁에 계셔 자비로 날 감싸 주시네 주님 앞에 이 몸을 맡길 때 힘 주시네 위로함 주네 주님의 그 자비로운 손길 항상 좋은 것 주시도다 사랑스레 아픔과 기쁨을 수고와 평화와 안식을 날마다 날마다 자비로 감싸주시네 자비로 감싸주시네 날마다 날마다 자비로 감싸주시네 자비로 감싸주시네 날마다 날마다 자비로 감싸주시네 자비로 감싸주시네 날마다 날마다 자비로 감싸주시네 자비로 감싸주시네 어린 나를 품에 안으시사 항상 평안함 주시도다 내가 살아 숨을 쉬는 동안 살피신다 약속하셨네 주님의 도우심 바라보며 모든 어려움 이기도다 흘러가는 순간순간마다 주님 약속 새겨봅니다 흘러가는 순간순간마다 주님 약속 새겨봅니다
브라운 워십,나는 알아요,나는 알아요 나 기도할 때 주님 곁에서 모두 듣고 계신것 나는 주님 느낄 수 있어요 나 기도하며 주님 앞에 나갈 때 조용히 내 곁에 오셔서 내 맘 어루만지시고 놀라운 주님의 그 평안 내 맘에 채워주시네 주님 언제나 함께하시네 어려운 일 당할때 또 기쁜 일에도 함께 하시네 주님 언제나 함께하시네 나는 알고 있어요 주님 내 곁에 계심을 나는 알아요 나 어려울 때 주님 날 위해 기도하고 계신것 주님 항상 날 기다리시네 내 모든 염려 가지고 나아오길 조용히 내 곁에 오셔서 내 맘 어루만지시고 놀라운 주님의 그 평안 내 맘에 채워주시네 주님 언제나 함께하시네 어려운 일 당할때 또 기쁜 일에도 함께 하시네 주님 언제나 함께하시네 나는 알고 있어요 주님 내 곁에  주님 언제나 함께하시네 어려운 일 당할때 또 기쁜 일에도 함께 하시네 주님 언제나 함께하시네 나는 알고 있어요 나는 알고 있어요 우린 알고 있어요 주님 내 곁에  나는 알고 있어요 주님 내 곁에 계심을
브라운 워십,너 시험을 당해,너 시험을 당해 죄 짓지 말고 너 용기를 다해 곧 물리치라 너 시험을 이겨 새 힘을 얻고 주 예수를 믿어 늘 승리하라 우리 구주의 힘과 그의 위로를 빌라 주님 네 편에 서서 항상 도우시리 네 친구를 삼가 잘 선택하고 너 언행을 삼가 늘 조심하라 너 열심을 다해 늘 충성하고 온 정성을 다해 주 봉사하라 우리 구주의 힘과 그의 위로를 빌라 주님 네 편에 서서 항상 도우시리 잘 이기는 자는 상 받으리니 너 낙심치 말고 늘 전진하라 네 구세주 예수 힘 주시리니 주 예수를 믿어 늘 승리하라 우리 구주의 힘과 그의 위로를 빌라 주님 네 편에 서서 항상 도우시리 우리 구주의 힘과 그의 위로를 빌라 주님 네 편에 서서 항상 도우시리 우리 구주의 힘과 그의 위로를 빌라 주님 네 편에 서서 항상 도우시리 우리 구주의 힘과 그의 위로를 빌라 주님 네 편에 서서 항상 도우시리
브라운 워십,마음속에 근심 있는 사람,마음속에 근심 있는 사람 주 예수 앞에 다 아뢰어라 슬픈 마음 있을 때에라도 주 예수께 아뢰라 주 예수 앞에 다 아뢰어라 주 우리의 친구니 무엇이나 근심하지 말고 주 예수께 아뢰라 눈물 나며 깊은 한숨 쉴 때 주 예수 앞에 다 아뢰어라 은밀한 죄 네게 있더라도 주 예수께 아뢰라 주 예수 앞에 다 아뢰어라 주 우리의 친구니 무엇이나 근심하지 말고 주 예수께 아뢰라 괴로움과 두려움 있을 때 주 예수 앞에 다 아뢰어라 내일 일을 염려하지 말고 주 예수께 아뢰라 주 예수 앞에 다 아뢰어라 주 우리의 친구니 무엇이나 근심하지 말고 주 예수께 아뢰라 주 예수 앞에 다 아뢰어라 주 우리의 친구니 무엇이나 근심하지 말고 주 예수께 아뢰라 주 예수 앞에 다 아뢰어라 주 우리의 친구니 무엇이나 근심하지 말고 주 예수께 아뢰라
