아티스트,타이틀,가사
아이자야씩스티원(Isaiah6tyOne),하나님의 나라,주가 통치하시고 다스리시는 나라 주를 향한 찬양이 멈추지 않는 고통과 아픔이 없는 하나님 나라 먼저 그의 나라와 그의 의를 구할때 모든 것 더하리라 말씀하신 주 세상 염려 내려놓고 주께 경배해 만왕의 왕 되신 예수여 내 안에 임하소서 주의 나라 내게 임할때 나 외쳐 선포해 하나님의 나라 내 안에 이루소서 주가 다스리시는 그 나라 주의 나라 임할때 모든 두렴 사라져 내 안에 주의 나라 세우시네 주가 통치하시고 다스리시는 나라 주를 향한 찬양이 멈추지 않는 고통과 아픔이 없는 하나님 나라 먼저 그의 나라와 그의 의를 구할때 모든 것 더하리라 말씀하신 주 세상 염려 내려놓고 주께 경배해 만왕의 왕 되신 예수여 내 안에 임하소서 주의 나라 내게 임할때 나 외쳐 선포해 만왕의 왕 되신 예수여 내 안에 임하소서 주의 나라 내게 임할때 나 외쳐 선포해 하나님의 나라 내 안에 이루소서 주가 다스리시는 그 나라 주의 나라 임할때 모든 두렴 사라져 내 안에 주의 나라 세우시네 하나님의 나라 내 안에 이루소서 주가 다스리시는 그 나라 주의 나라 임할때 모든 두렴 사라져 내 안에 주의 나라 세우시네 Your Kingdom come Your will be done In our hearts oh God Your Kingdom come Your will be done In our hearts oh God
아이자야씩스티원(Isaiah6tyOne),한 사람,한 사람이면 충분했던 주님 주 말씀에 순종하는 자 한 걸음마다 하나님 말씀 의지하여 주님의 마음에 동참하는 자 그 사람이 내가 되길 원해 주 말씀에 순종하는 자 한 걸음마다 하나님 말씀 의지하여 주님의 마음에 동참하는 자 나를 향한 계획 주님이 잘 아시네 주를 향한 나의 삶 전심으로 주께 경배해 그 사람이 내가 되길 원해 주 말씀에 순종하는 자 한 걸음마다 하나님 말씀 의지하여 주님의 마음에 동참하는 자 나를 향한 계획 주님이 잘 아시네 주를 향한 나의 삶 전심으로 주께 경배해 주님의 뜻 선하시며 언제나 함께하시네 주를 향한 나의 마음 온 맘 다해 주를 신뢰해 나를 향한 계획 주님이 잘 아시네 주를 향한 나의 삶 전심으로 주께 경배해 주님의 뜻 선하시며 언제나 함께하시네 주를 향한 나의 마음 온 맘 다해 주를 신뢰해 한 사람이면 충분했던 주님 주 말씀에 순종하는 자 한 걸음마다 하나님 말씀 의지하여 주님의 마음에 동참하는 자
아이자야씩스티원(Isaiah6tyOne),새로운 마음,예수 하나님의 아들 말씀으로 오신 주 그 말씀을 믿는 자들마다 새로운 마음 주시네 예수 하나님의 본체 사랑으로 오신 주 그 사랑이 날 찾아오셔서 새로운 마음 주시네 우리의 마음 돌이켜 주의 말씀 앞에 나와 모든 우상들 다 버리고 하나님만 경배하네 새로운 맘 주시고 주님의 성령을 부으사 우리 안에 굳은 마음 제하여 주님의 마음 주소서 그리하여 내 삶이 주의 말씀 안에 거하며 주의 영광 주의 나라 드러나는 삶 되게 하소서 우리의 마음 돌이켜 주의 말씀 앞에 나와 모든 우상들 다 버리고 하나님만 경배하네 새로운 맘 주시고 주님의 성령을 부으사 우리 안에 굳은 마음 제하여 주님의 마음 주소서 그리하여 내 삶이 주의 말씀 안에 거하며 주의 영광 주의 나라 드러나는 삶 되게 하소서 새로운 맘 주시고 주님의 성령을 부으사 우리 안에 굳은 마음 제하여 주님의 마음 주소서 그리하여 내 삶이 주의 말씀 안에 거하며 주의 영광 주의 나라 드러나는 삶 되게 하소서
아이자야씩스티원(Isaiah6tyOne),하나님 얼굴 구하는 세대,주의 나라를 구하는 세대로 주의 이름만 구하는 세대로 나의 모든 우상들 다 버리고 주의 이름만 나 경배하오니 승리의 깃발 들은 주의 백성 이 땅의 무너진 곳을 세우리 주여 우리 죄를 용서하시고 다시 이 땅에 부흥을 주소서 다시 이 땅에 부흥을 주소서 하나님 얼굴 구하는 세대 예수 이름만 구하는 하나님의 부흥의 세대로 더 이상 부끄러워 않으리 예수 이름만 외치리 온 맘다해 주 이름 찬양해 승리의 깃발 들은 주의 백성 이 땅의 무너진 곳을 세우리 주여 우리 죄를 용서하시고 다시 이 땅에 부흥을 주소서 다시 이 땅에 부흥을 주소서 하나님 얼굴 구하는 세대 예수 이름만 구하는 하나님의 부흥의 세대로 더 이상 부끄러워 않으리 예수 이름만 외치리 온 맘다해 주 이름 찬양해 하나님 얼굴 구하는 세대 예수 이름만 구하는 하나님의 부흥의 세대로 더 이상 부끄러워 않으리 예수 이름만 외치리 온 맘다해 주 이름 찬양해 할렐루야 할렐루야 할렐루야 아멘 할렐루야 할렐루야 할렐루야 아멘
아이자야씩스티원(Isaiah6tyOne),이 세상을 본받지 않으며 (부제 : 주님이 부르신 곳),주님이 부르신 곳 그곳에서 예배합니다 주님이 이끄신 곳 그곳에서 경배합니다 주님이 기뻐하시는 거룩한 삶의 예배 온전한 예배 드리기 원하네 이 세상을 본받지 않으며 마음을 새롭게 하여 변화되게 하소서 하나님의 선하시고 기뻐하시는 완전하신 뜻 무엇인지 알게 하소서 주님이 부르신 곳 그곳에서 예배합니다 주님이 이끄신 곳 그곳에서 경배합니다 주님이 기뻐하시는 거룩한 삶의 예배 온전한 예배 드리기 원하네 이 세상을 본받지 않으며 마음을 새롭게 하여 변화되게 하소서 하나님의 선하시고 기뻐하시는 완전하신 뜻 무엇인지 알게 하소서 주님의 성령을 우리에게 부으사 주님의 온전한 뜻 이루게 하소서 주님의 성령을 우리에게 부으사 주님의 온전한 뜻 이루게 하소서 이 세상을 본받지 않으며 마음을 새롭게 하여 변화되게 하소서 하나님의 선하시고 기뻐하시는 완전하신 뜻 무엇인지 알게 하소서 이 세상을 본받지 않으며 마음을 새롭게 하여 변화되게 하소서 하나님의 선하시고 기뻐하시는 완전하신 뜻 무엇인지 알게 하소서 주님이 이끄신 곳 그곳에서 경배합니다
아이자야씩스티원(Isaiah6tyOne),말씀하소서,하나님의 말씀을 내 마음에 새겨 나의 뜻을 나의 삶을 다시 돌아봅니다 복 있는 사람은 악인의 꾀를 쫓지 않고 죄인의 길에 서지 아니하며 오만한 자의 자리에 앉지 아니하고 주의 말씀을 주야로 즐거워 하는 도다 주 하나님 내게 말씀하소서 주의 말씀 듣기 나 원합니다 주 하나님 내게 말씀하시네 주님의 뜻 알기 나 원합니다 주 말씀은 살아계셔 나를 보게 하시고 말씀으로 나의 삶을 인도하여 주소서 복 있는 사람은 악인의 꾀를 쫓지 않고 죄인의 길에 서지 아니하며 오만한 자의 자리에 앉지 아니하고 주의 말씀을 주야로 즐거워 하는 도다 주 하나님 내게 말씀하소서 주의 말씀 듣기 나 원합니다 주 하나님 내게 말씀하시네 주님의 뜻 알기 나 원합니다 주 하나님 내게 말씀하소서 주의 말씀 듣기 나 원합니다 주 하나님 내게 말씀하시네 주님의 뜻 알기 나 원합니다 주 하나님 내게 말씀하소서 주의 말씀 듣기 나 원합니다 주 하나님 내게 말씀하시네 주님의 뜻 알기 나 원합니다
아이자야씩스티원(Isaiah6tyOne),오 나의 하나님은 (Feat. 임다미),오 나의 하나님은 전능하신 왕이라 오 나의 하나님은 평강의 왕이라 오 신실하신 사랑 영원히 변치않네 오 영원하신 이름 그 이름 찬양해 예수 앞을 볼 수 없는 일어설 수 도 없는 어두웠던 삶도 그가 다시 일으키시네 돌아갈 수 없는 바라볼 수도 없는 실패했던 삶도 그가 다시 세워주시네 오 나의 하나님은 전능하신 왕이라 오 나의 하나님은 평강의 왕이라 오 신실하신 사랑 영원히 변치않네 오 영원하신 이름 그 이름 찬양해 오 나의 하나님은 전능하신 왕이라 오 나의 하나님은 평강의 왕이라 오 신실하신 사랑 영원히 변치않네 오 영원하신 이름 그 이름 찬양해 예수 예수 예수 예수 예수 예수 예수 예수 예수
아이자야씩스티원(Isaiah6tyOne),하나님 말씀으로,우리가 살고 있는 이 세상은 주님의 손길 안 닿은 곳 없네 주님의 말씀을 갈망하는 우리에게 하늘의 비밀 알려주시네 어두움 가운데있던 이 세상에 빛으로 오신 하나님의 아들 그의 말씀을 믿는 모든 이들에게 하늘의 영광 비춰주시네 하나님 말씀으로 아버지 마음으로 나 달려갑니다 나 돌아갑니다 말씀이 육신되어 말씀이 내삶되어 주 나라 이곳에 주님 뜻 내 안에 이루소서 어두움 가운데있던 이 세상에 빛으로 오신 하나님의 아들 그의 말씀을 믿는 모든 이들에게 하늘의 영광 비춰주시네 하나님 말씀으로 아버지 마음으로 나 달려갑니다 나 돌아갑니다 말씀이 육신되어 말씀이 내삶되어 주 나라 이곳에 주님 뜻 내 안에 이루소서 듣지 못했던 마음 주님의 성령 오셔서 보지 못했던 나의 눈 주를 보게하시네 듣지 못했던 마음 주님의 성령 오셔서 보지 못했던 나의 눈 주를 보게하시네 하나님 말씀으로 아버지 마음으로 나 달려갑니다 나 돌아갑니다 말씀이 육신되어 말씀이 내삶되어 주 나라 이곳에 주님 뜻 내 안에 이루소서
아이자야씩스티원(Isaiah6tyOne),신실하시네,내 맘이 헛된 욕심에 갇혀 주의 선하신 뜻을 보지 못할 때 내 맘의 눈을 돌이키시고 주의 말씀으로 날 인도하소서 모든 두려움 버리고 주의 약속만을 바라봅니다 나의 피난처 되시는 방패 되신 주만 의지하리라 주의 뜻 하늘 보다 높고 바다 보다 깊고 신실하시네 내 마음 다하여 주님이 계신 그 곳으로 나아가리라 내 맘이 헛된 욕심에 갇혀 주의 선하신 뜻을 보지 못할 때 내 맘의 눈을 돌이키시고 주의 말씀으로 날 인도하소서 모든 두려움 버리고 주의 약속만을 바라봅니다 나의 피난처 되시는 방패 되신 주만 의지하리라 주의 뜻 하늘 보다 높고 바다 보다 깊고 신실하시네 내 마음 다하여 주님이 계신 그 곳으로 나아가리라 영원히 신실하신 주의 사랑 무엇도 끊을 수 없는 사랑 모든 영광과 찬양 받으소서 영원토록 주 이름 찬양해 영원히 신실하신 주의 사랑 무엇도 끊을 수 없는 사랑 모든 영광과 찬양 받으소서 영원토록 주 이름 찬양해 주의 뜻 하늘 보다 높고 바다 보다 깊고 신실하시네 내 마음 다하여 주님이 계신 그 곳으로 나아가리라
아이자야씩스티원(Isaiah6tyOne),빛으로 비추시네,주의 선하심과 진실함을 닮기원해 그의 빛으로 나갈 때 그 성품 닮아가네 빛을 닮아갈 때 주가 주신 자유함으로 옳은데로 돌아와서 별같이 비추네 빛으로 비추시네 어둠이 드러나고 나를 숨은 허물에서 벗어나게 하시네 빛으로 일어서네 어둠이 밝혀지고 빛되신 우리주와 그 생명길 가네 주의 선하심과 진실함을 닮기원해 그의 빛으로 나갈 때 그 성품 닮아가네 빛을 닮아갈 때 주가 주신 자유함으로 옳은데로 돌아와서 별같이 비추네 빛으로 비추시네 어둠이 드러나고 나를 숨은 허물에서 벗어나게 하시네 빛으로 일어서네 어둠이 밝혀지고 빛되신 우리주와 그 생명길 가네 내 영혼아 일어나 주의 빛 발하라 주의 영광이 우리 위에 임하였네 내 영혼아 일어나 주의 빛 발하라 주의 영광이 우리 위에 임하였네 내 영혼아 일어나 주의 빛 발하라 주의 영광이 우리 위에 임하였네 빛으로 비추시네 어둠이 드러나고 나를 숨은 허물에서 벗어나게 하시네 빛으로 일어서네 어둠이 밝혀지고 빛되신 우리주와 그 생명길 가네 빛으로 비추시네 어둠이 드러나고 나를 숨은 허물에서 벗어나게 하시네 빛으로 일어서네 어둠이 밝혀지고 빛되신 우리주와 그 생명길 가네 빛되신 우리주와 그 생명길 가네 빛되신 우리주와 그 생명길 가네 빛되신 우리주와 그 생명길 가네
아이자야씩스티원(Isaiah6tyOne),주 이름 찬양해 (할렐루야),주님의 이름 안에 우리 모여 찬양하네 우리 마음 하나 되어 예수 이름 높이기 원해 우릴 향한 놀라우신 주의 사랑 우릴 향해 노래하시네 할렐루야 할렐루야 할렐루야 주 이름 찬양해 주님의 이름 안에 우리 모여 찬양하네 우리 마음 하나 되어 예수 이름 높이기 원해 우릴 향한 놀라우신 주의 사랑 우릴 향해 노래하시네 그 무엇도 감출 수 없는 주의 사랑 온 맘 다해 나 노래하리 할렐루야 할렐루야 할렐루야 주 이름 찬양해 할렐루야 할렐루야 할렐루야 주 이름 찬양해 위대하신 전능의 주 다 찬양해 거룩 거룩 거룩하신 주 다 경배해 위대하신 전능의 주 다 찬양해 거룩 거룩 거룩하신 주 다 경배해 할렐루야 할렐루야 할렐루야 주 이름 찬양해 할렐루야 할렐루야 할렐루야 주 이름 찬양해
아이자야씩스티원(Isaiah6tyOne),오 나의 하나님은,오 나의 하나님은 전능하신 왕이라 오 나의 하나님은 평강의 왕이라 오 신실하신 사랑 영원히 변치 않네 오 영원하신 이름 그 이름 찬양해 앞을 볼 수 없는 일어설 수도 없는 어두웠던 삶도 그가 다시 일으키시네 돌아갈 수 없는 바라볼 수도 없는 실패했던 삶도 그가 다시 세워주시네 오 나의 하나님은 전능하신 왕이라 오 나의 하나님은 평강의 왕이라 오 신실하신 사랑 영원히 변치 않네 오 영원하신 이름 그 이름 찬양해 오 나의 하나님은 전능하신 왕이라 오 나의 하나님은 평강의 왕이라 오 신실하신 사랑 영원히 변치 않네 오 영원하신 이름 그 이름 찬양해 예수 예수 예수 예수 예수 예수 예수 예수 예수
아이자야씩스티원(Isaiah6tyOne),나를 가르치소서,주님의 뜻 알기 원하니 주의 길을 내게 가르치소서 진리로 날 인도하시고 성령으로 나를 가르치소서 주의 성령은 선하신 분이니 나를 바른 길로 인도하소서 주의 말씀 앞에 순종하오니 기쁨으로 깨닫게 하소서 나의 하나님 주의 뜻을 행하도록 가르치소서 나의 구원자 되시니 내가 평생 주를 바라봅니다 주의 길을 가르치시며 진리 가운데 걸어가게 하소서 한결같은 마음 더하사 주의 이름 두려워하게 하소서 주의 성령은 선하신 분이니 나를 바른 길로 인도하소서 주의 말씀 앞에 순종하오니 기쁨으로 깨닫게 하소서 나의 하나님 주의 뜻을 행하도록 가르치소서 나의 구원자 되시니 내가 평생 주를 바라봅니다 나의 하나님 주의 뜻을 행하도록 가르치소서 나의 구원자 되시니 내가 평생 주를 바라봅니다 주의 성령은 선하신 분이니 나를 바른 길로 인도하소서 주의 말씀 앞에 순종하오니 기쁨으로 깨닫게 하소서 나의 하나님 주의 뜻을 행하도록 가르치소서 나의 구원자 되시니 내가 평생 주를 바라봅니다 나의 하나님 주의 뜻을 행하도록 가르치소서 나의 구원자 되시니 내가 평생 주를 바라봅니다
아이자야씩스티원(Isaiah6tyOne),주님의 임재를,주님의 임재를 사모하네 주님의 마음을 닮기 원하네 주님의 은혜를 사모하네 주님의 음성을 듣기 원하네 영원한 생명의 강물 목마름 없네 날 회복케 해 영원한 생명의 말씀 부족함 없네 날 자유케 해 나 달려가리 주께 달려가리 주께 주님이 있는 곳 주님의 임재로 나 달려가리 영원한 생명의 강물 목마름 없네 날 회복케 해 영원한 생명의 말씀 부족함 없네 날 자유케 해 영원한 생명의 강물 목마름 없네 날 회복케 해 영원한 생명의 말씀 부족함 없네 날 자유케 해 나 달려가리 주께 달려가리 주께 주님이 있는 곳 주님의 임재로 나 달려가리 나 달려가리 주께 달려가리 주께 주님이 있는 곳 주님의 임재로 나 달려가리 All I need is you All I need is you All I need is you All I need is you 주님의 임재를 사모하네 주님의 마음을 닮기원하네
아이자야씩스티원(Isaiah6tyOne),I'm Not Ashamed,I’m not ashamed I’m not ashamed 예수 나의 능력되시네 I’m not afraid I’m not afraid 예수 나와 함께하시네 I’m not ashamed I’m not ashamed 예수 나의 능력되시네 I’m not afraid I’m not afraid 예수 나와 함께하시네 아무도 없는 광야에서도 보이지 않는 어둠 속에도 주님 나와 영원토록 함께하시네 꺼져가는 등불 끄지 않으신 상한 갈대 꺾지 않으시는 예수 나의 좋으신 주 I’m not alone I’m not alone 한 순간도 떠난 적 없네 Christ in me Christ in me 내 모든 삶 주 안에 있네 아무도 없는 광야에서도 보이지 않는 어둠 속에도 주님 나와 영원토록 함께하시네 꺼져가는 등불 끄지 않으신 상한 갈대 꺾지 않으시는 예수 나의 좋으신 주 Emmanuel Emmanuel 예수 내 안에 계시네 I’m not ashamed I’m not ashamed 예수 내 능력되시네 Emmanuel Emmanuel 예수 내 안에 계시네 I’m not ashamed I’m not ashamed 예수 내 능력되시네
아이자야씩스티원(Isaiah6tyOne),전신갑주,전신갑주 입고 마귀들을 때려 부숴 승리 주신 주께 우리 모두 Put your hands up 전신갑주 입고 마귀들을 때려 부숴 승리 주신 주께 우리 모두 Put your hands up 전신갑주 입어 마귀들과 싸워 이겨 전신갑주 입어 마귀들과 싸워 이겨 우리의 싸움은 혈과 육이 아니라네 보이지 않는 어둠의 악한 영과 싸우네 악한 날에 원수들과 싸워 이기도록 하나님의 전신갑주로 모두 완전무장 진리의 허리띠 의의 흉배 복음의 신발 믿음의 방패 구원의 투구 성령의 검 ay 하나님 말씀 진리의 허리띠 의의 흉배 복음의 신발 믿음의 방패 구원의 투구 성령의 검 ay 하나님 말씀 전신갑주 입고 마귀들을 때려 부숴 승리 주신 주께 우리 모두 Put your hands up 전신갑주 입고 마귀들을 때려 부숴 승리 주신 주께 우리 모두 Put your hands up 전신갑주 입어 마귀들과 싸워 이겨 전신갑주 입어 마귀들과 싸워 이겨 사망 권세 다 이기고 승리하신 주님 임마누엘 우리 안에 함께 하시오니 전신갑주 입고 이미 이긴 싸움해 예수 승리의 이름 높여 높여 찬양해 진리의 허리띠 의의 흉배 복음의 신발 믿음의 방패 구원의 투구 성령의 검 ay 하나님 말씀 진리의 허리띠 의의 흉배 복음의 신발 믿음의 방패 구원의 투구 성령의 검 ay 하나님 말씀 전신갑주 입고 마귀들을 때려 부숴 승리 주신 주께 우리 모두 Put your hands up 전신갑주 입고 마귀들을 때려 부숴 승리 주신 주께 우리 모두 Put your hands up 전신갑주 입어 마귀들과 싸워 이겨 전신갑주 입어 마귀들과 싸워 이겨 전신갑주 입어 마귀들과 싸워 이겨 전신갑주 입어 마귀들과 싸워 이겨
아이자야씩스티원(Isaiah6tyOne),주님이 부르신 곳,주님이 부르신 곳 그곳에서 예배합니다 주님이 이끄신 곳 그곳에서 경배합니다 주님이 기뻐하시는 거룩한 삶의 예배 온전한 예배 드리기 원하네 이 세상을 본받지 않으며 마음을 새롭게 하여 변화되게 하소서 하나님의 선하시고 기뻐하시는 완전하신 뜻 무엇인지 알게 하소서 주님이 이끄신 곳 그곳에서 경배합니다 주님이 기뻐하시는 거룩한 삶의 예배 온전한 예배 드리기 원하네 이 세상을 본받지 않으며 마음을 새롭게 하여 변화되게 하소서 하나님의 선하시고 기뻐하시는 완전하신 뜻 무엇인지 알게 하소서 주님의 성령을 우리에게 부으사 주님의 온전한 뜻 이루게 하소서 주님의 성령을 우리에게 부으사 주님의 온전한 뜻 이루게 하소서 이 세상을 본받지 않으며 마음을 새롭게 하여 변화되게 하소서 하나님의 선하시고 기뻐하시는 완전하신 뜻 무엇인지 알게 하소서 주님이 이끄신 곳 그곳에서 경배합니다
아이자야씩스티원(Isaiah6tyOne),성령 하나님,성령 하나님 오소서 아버지 마음 잘 아시는 성령 하나님 진리의 성령 오셔서 아버지의 선하신 뜻 알게 하소서 모든 비진리 무너지고 주님의 성령을 부어주사 이 땅에 무너진 성벽을 주님의 진리로 세워주소서 성령이여 임하소서 우리 안에 임하소서 주님만 더 갈망해요 우리에게 임하소서 진리의 성령 오셔서 아버지의 선하신 뜻 알게 하소서 모든 비진리 무너지고 주님의 성령을 부어주사 이 땅에 무너진 성벽을 주님의 진리로 세워주소서 모든 비진리 무너지고 주님의 성령을 부어주사 이 땅에 무너진 성벽을 주님의 진리로 세워주소서 성령이여 임하소서 우리 안에 임하소서 주님만 더 갈망해요 우리에게 임하소서 성령이여 임하소서 우리 안에 임하소서 주님만 더 갈망해요 우리에게 임하소서
아이자야씩스티원(Isaiah6tyOne),Again,기묘자 모사라 전능하신 주님 누가 주와 같으리요 누가 주와 같으리요 눈먼 자 묶인 자 소망이 없는 자 주가 일으켜 주시네 주가 일으켜 주시네 이전과 같지 않으리 뒤돌아 서지 않으리 어떠한 어려움에도 Again 우리 다시 일어나 Again 주를 향해 달려가 주님 앞에서 기뻐 뛰며 찬양해 Again 돌아서지 않으리 Again 멈춰서지 않으리 주의 말씀만 나 따라가리라 기묘자 모사라 전능하신 주님 누가 주와 같으리요 누가 주와 같으리요 눈먼 자 묶인 자 소망이 없는 자 주가 일으켜 주시네 주가 일으켜 주시네 이전과 같지 않으리 뒤돌아 서지 않으리 어떠한 어려움에도 이전과 같지 않으리 뒤돌아 서지 않으리 어떠한 어려움에도 Again 우리 다시 일어나 Again 주를 향해 달려가 주님 앞에서 기뻐 뛰며 찬양해 Again 돌아서지 않으리 Again 멈춰서지 않으리 주의 말씀만 나 따라가리라 Again 우리 다시 일어나 Again 주를 향해 달려가 주님 앞에서 기뻐 뛰며 찬양해 Again 돌아서지 않으리 Again 멈춰서지 않으리 주의 말씀만 나 따라가리라
아이자야씩스티원(Isaiah6tyOne),Your Love,주 사랑이 날 찾아와 하나님 사랑 보이셨네 주의 사랑 변함없는 언제나 동일하신 주님 십자가에 달리심은 우리를 사랑하신 증거 죽기까지 사랑함이 내 모든 죄 사하셨네 Your Love 영원하신 주님의 사랑 Your Love 찬양해 완전한 주 사랑 주 사랑이 날 찾아와 하나님 사랑 보이셨네 주의 사랑 변함없는 언제나 동일하신 주님 십자가에 달리심은 우리를 사랑하신 증거 죽기까지 사랑함이 내 모든 죄 사하셨네 십자가에 달리심은 우리를 사랑하신 증거 죽기까지 사랑함이 내 모든 죄 사하셨네 Your Love 영원하신 주님의 사랑 Your Love 찬양해 완전한 주 사랑 온전한 사랑안엔 두려움 없네 나를 향한 주의 사랑 무엇도 끊을 수 없네 온전한 사랑안엔 두려움 없네 나를 향한 주의 사랑 무엇도 끊을 수 없네 온전한 사랑안엔 두려움 없네 나를 향한 주의 사랑 무엇도 끊을 수 없네 Your Love 영원하신 주님의 사랑 Your Love 찬양해 완전한 주 사랑 Your Love 영원하신 주님의 사랑 Your Love 찬양해 완전한 주 사랑
아이자야씩스티원 예술학교,그 이름 예수,예수 하나님의 아들  우릴 위해 이땅에 오셨네 아무도 볼 수 없는 피난처 예수 세상이 줄 수 없는 그분의 사랑 그 이름 예수 그 이름 예수 모든 하늘보다  모든 바다보다  높고 크신 이름 그 이름 예수 예수 하나님의 아들  우릴 위해 이땅에 오셨네 아무도 볼 수 없는 피난처 예수 세상이 줄 수 없는 그분의 사랑 그 이름 예수 그 이름 예수 모든 하늘보다  모든 바다보다  높고 크신 이름 그 이름 예수 그 이름 예수 모든 하늘보다  모든 바다보다  높고 크신 이름 그 이름 예수
